AuthorID,Author,Date,Content,Attachments,Reactions
"1365118310701600900","rtimothyedwards_19428","2026-07-01T00:45:36.7650000+00:00","Test of writing to the lower 4 bits of 64 words at 25MHz (also works at 50MHz but it's at the sampling limit of the USB scope).","2026-07_media/4bit_count_bench_test-45506.png",""
"1365118310701600900","rtimothyedwards_19428","2026-07-01T00:52:18.8220000+00:00","Test setup with one Digilent Analog Discovery 2.","2026-07_media/sram_test_2a-E7B04.jpg","💜 (6)"
"262706220073222144","namibj","2026-07-01T15:05:57.0520000+00:00","Can we get some amount of reporting as to how good as a PUF that SRAM behaves?
Like, reading the power-on bit pattern of a few dies and seeing how stable and unique it is per-die?

If it's at least not-terrible, I could try next week about getting a probably-smallest-tested SRAM macro set up, if I can think of a way to read it _at all_ without an electrical pad contact to the die.","",""
"1365118310701600900","rtimothyedwards_19428","2026-07-01T15:26:01.6010000+00:00","@namibj :  I don't have any kind of temperature force unit, so I won't be able to determine if the power-up pattern is stable over temperature.  I would tend to expect it to be dependent on the 3.3V supply ramp, as well.","",""
"262706220073222144","namibj","2026-07-01T16:03:12.1620000+00:00","temperature stability shouldn't matter tooo much; trying voltage corners of the nominal-3v3, or, if not difficult, operation at reduced voltage (e.g. the foundry `Dualgate` SCL is rated down to 1.62V) would be plenty sufficcient to get an idea of if it's looking to be usable or not.

It doesn't have to be an exact match of the pattern, it just has to be closest-match by a physically-inspired metric (notably, I'd figure accounting for the impact of mismatch in the sense amplifiers would help the statistical-model-based matching, like perhaps using a polynomial chaos expansion surrogate model to decorrelate w.r.t. supply ramps and (as needed) temperature, and focus on die-specific mismatch instead.

It'd be a next-week thing though, as this week I got the extended ttgf0p3 and have already pushed schedule from the next two days to the weekend.","",""
"728516105680846892","chips4makers","2026-07-01T16:08:23.0730000+00:00","I think what you will find is that some bit will always be the same at power-on but some will likely be more random. This means you'll need to transform this power-up pattern with random bits into a reproducible one.","",""
"262706220073222144","namibj","2026-07-01T18:30:31.4330000+00:00","Well, I _mostly_ care about it as being able to record them at the die sorter while the process still knows what reticle and what wafer any particular die came from (location within a reticle is obviously trivial to encode using mask ROM techniques), to then later post-packaging being able to read it out from in the circuit during e-testing and match it against the recorded database to recognize which of the dies it (with high likelihood) was, followed by printing the information onto a label or writing them into some type/choice of PROM, be it on-die or just on-PCB.","",""
"169786952432746498","mithro_","2026-07-07T15:00:16.0070000+00:00","The future CoB boards will have unqiue IDs. @Andrew Wingate is hoping to keep track of the die (where from the wafer they came from) as they are loaded into the tape. 

I'm also looking to source a large number of I2C EEPROMs which end up being 1-2 cents each.","","👍 (1)"
"220639106915368960","tholin","2026-07-07T15:08:25.6370000+00:00","Clearly, the perfect solution is","2026-07_media/image-62E4C.png,2026-07_media/image-498BE.png",""
"262706220073222144","namibj","2026-07-07T15:39:27.6430000+00:00","Oh great.","",""
"691780627338625077","rebelmike","2026-07-15T19:45:44.5720000+00:00","First draft of 0p5x1 CoB.  Revisions compared with previous CoBs / previous attempt at this one:
- Principle of least surprise:  Schematic has pin 1 where the project template does.  Pads (except for power) are in the same order on the mezzanine connector as on the die.
- Wafer space logo moved to bottom right, so it matches the top left position on the run 2 dies
- Solder mask added between the die and pad ring
- No Ground flood fill exclusion between die and pad ring
- Pin 1 marker is in copper

Feedback welcome","2026-07_media/image-14C26.png",""
"691780627338625077","rebelmike","2026-07-15T19:49:30.7540000+00:00","One note: It'll be natural to hold these the other way up, to match the die orientation.  I think that's good, but it does mean mezzanine connector pin 1 is at the bottom, which is potentially confusing.  (Although at least on my motherboard, and I saw on the KianV one too, the CoB is mounted upside down anyway).
And one question: The ground plated through holes between the die and the pad ring, sohuld they just be normal vias?  Then all the holes should be tented, which may avoid issues with bubbles?","",""
"691780627338625077","rebelmike","2026-07-15T19:50:52.4060000+00:00","Project is here: https://github.com/MichaelBell/chip-on-board-wire-bonded-pcbs/tree/0p5x1-mezzanine/run-1/0p5x1-cob","","👀 (1)"
"262706220073222144","namibj","2026-07-15T20:12:32.2650000+00:00","IIUC/IIRC what you don't want is non-through-holes that hold an air bubble at their bottom, which get filled with epoxy that has a hard time displacing the air, thus causing those very bubbles to get stuck in the epoxy.

I'm not sure if you're allowed through holes which would let the air escape down as the epoxy flows into the hole, as the epoxy could theoretically droop down and form drops on the bottom.","",""
"691780627338625077","rebelmike","2026-07-15T22:12:37.8250000+00:00","Cool, so probably nothing inherently wrong with keeping them, unless that's been a problem in the existing CoBs.","",""
"262706220073222144","namibj","2026-07-15T23:44:04.9170000+00:00","IIRC the issue before was that the bottom of those was tented, but the top was open. 

The cob bond house might have issues with open holes if there's worry about epoxy dripping and leaving hardened residues in places they shouldn't be; I don't know the viscosity and surface tension enough to judge if that's an actual risk with the current chemistry and thicknesses, though.

IMO keep them open and prepare to be told to tent the tops if necessary; I won't have time to search for what judgement the earlier discussions came up with, until 2 weeks from now.","",""
"691780627338625077","rebelmike","2026-07-16T23:14:00.1180000+00:00","And the 0p5x0p5 version:","2026-07_media/image-D0100.png","🔥 (7)"
"1071653002986926112","algofoogle","2026-07-23T14:04:43.7710000+00:00","Is there a convention for the pin numbering of the wafer.space standard template padring pads? For instance, it looks like the left end of the south side is always `clk` by default, so is this a good one to call pin 1, and the rest increment in an anti-clockwise direction from there?","",""
"691780627338625077","rebelmike","2026-07-23T14:31:58.9360000+00:00","Yes.  The intention is that left end of south is pin 1 in the project template, and you go anti-clockwise from there.  Unfortunately the run 1 CoBs mount the die rotated by 180 degrees, so that then ends up with pin 1 at the top right.","","👍 (1)"
"147848641153990657","kris____","2026-07-23T17:57:48.6390000+00:00","the corner pads look so cool","",""
"220639106915368960","tholin","2026-07-23T18:05:39.8430000+00:00","I did ensure my layout’s padring was compatible with the standard COB this time, but I still need to check if the COB breaks out the pins how I need them.","",""
"691780627338625077","rebelmike","2026-07-23T18:44:54.3180000+00:00","As long as you have power and ground in the same place as the template it should work.","","👍 (1)"
"220639106915368960","tholin","2026-07-23T18:47:22.5410000+00:00","I’m using the level-shifting pads","",""
"220639106915368960","tholin","2026-07-23T18:47:31.2540000+00:00","And do have different core and IO voltages in mind","",""
"691780627338625077","rebelmike","2026-07-23T19:55:03.7190000+00:00","The power pins are all independent on the breakout, each with their own cap.  Only ground are connected together","",""
"220639106915368960","tholin","2026-07-23T19:58:51.0560000+00:00","What about IO? I've used every single pad.","",""
"756011607603019777","anfroholic","2026-07-23T20:00:57.0370000+00:00","They are all good as well. 
The only pads that never make it directly to the mezzanine are the ground pads, and those are all bridged.
Like Mike said, all the power pins are isolated, but also by default, have 1uF caps","",""
