AuthorID,Author,Date,Content,Attachments,Reactions
"220639106915368960","tholin","2025-12-10T19:32:52.2900000+00:00","Submitting this to precheck. Wish me luck.","project-template_media/chip_top_black-E9BF0.png","🤞 (6)"
"643551115920670720","digshadow","2025-12-10T20:36:10.9490000+00:00","I'm not really closely watching this, but if there is an image that you want let me know ASAP","",""
"643551115920670720","digshadow","2025-12-10T20:36:18.8550000+00:00","As I'm actively tearing down my lab right now for an indeterminate amount of time","",""
"596068704471482370","246tnt","2025-12-10T20:39:56.6770000+00:00","The block between the two large drawing has a tenuous link to power 😅   I guess at 5V the IR drop isn't all that big a deal but still, not sure if IR Drop stuff is properly setup in the default template.","",""
"220639106915368960","tholin","2025-12-10T20:53:48.0950000+00:00","There isn’t actually a lot of standard cells in there. 10% density. Its the project multiplexer","","👍 (1)"
