AuthorID,Author,Date,Content,Attachments,Reactions
"169786952432746498","mithro_","2026-02-05T21:23:51.6870000+00:00","@Tisham Dhar (CSIRO EASI) - Did you ever see this diagram -> https://docs.google.com/drawings/d/1N9guhJIMGBHqsPUN32olwNP8XzjwhM52Qibt6FMoyq0/edit ?","",""
"169786952432746498","mithro_","2026-02-05T21:26:10.6870000+00:00","@carlfk - Doesn't look like that diagram ended up in that folder...","",""
"443147704126668801","carlfk","2026-02-05T21:27:17.9270000+00:00","agreeed. it was made long before fpgas.online was regeisted","",""
"443147704126668801","carlfk","2026-02-05T21:28:28.5830000+00:00","search your drive for ""Independent"" - and page though the 100 hits :p","",""
"443147704126668801","carlfk","2026-02-05T21:29:09.8630000+00:00","really this was to give you a starting point for explaing your IP address needs","",""
