AuthorID,Author,Date,Content,Attachments,Reactions
"169786952432746498","mithro_","2025-12-01T04:48:56.5530000+00:00","","",""
"169786952432746498","mithro_","2025-12-01T05:19:43.8700000+00:00","@Ethan Mahintorabi - Anything interesting in https://ieeexplore.ieee.org/document/10833805 ?","",""
"474048939897782314","itisyeetimetoday","2025-12-01T06:43:39.0720000+00:00","It seems like for pure digital dense, the high density libraries SKY130 is around 170kG/mm^2 for raw/100kG/mm^2 for routed. GF180MCU doesn't have numbers I could find, but maybe it's around/better than SKY130? Anyone know what the numbers for SKY90/price is shaping up to be? Are there rumors/news about other nodes that will be open sourced?","",""
"596068704471482370","246tnt","2025-12-01T07:29:37.6070000+00:00","@itisyeetimetoday sky90 is dead afaik.  Also I'm not sure how you would think gf180mcu could ever be more dense than sky130 ... from an area density PoV it's way worse. raw routing wires are twice as big ( so 4 times worse in area ), cells are much much larger than the hd lib from sky130.","",""
"538398807986274304","rzioma","2025-12-01T09:00:41.3670000+00:00","@Tim 'mithro' Ansell @Ethan Mahintorabi afaik Andreas Andreou (from John Hopkins) and Shantanu Chakrabartty groups are working together on a new open-source DVS sensor. They plan to tapeout on 130nm.

It is part of annual Telluride Neuromorphic Workshop.","",""
"538398807986274304","rzioma","2025-12-01T09:04:24.9960000+00:00","Their prototype wasn’t very dense either, but promising","",""
"329773739061411861","_mwelling_","2025-12-01T16:01:49.3870000+00:00","@Tim 'mithro' Ansell congratulations on funding the first shuttle","","🥳 (4)"
"384390069412429834","polyfractal","2025-12-01T16:29:06.9050000+00:00","Started a thread.","",""
"169786952432746498","mithro_","2025-12-01T16:49:55.5870000+00:00","My current plan is,
 (1) Finish the https://platform.wafer.space deployment.
 (2) Bed.
 (3) Check how things have gone and evaluate an what the update should be.

Given the timeline, I'll probably port across any green prechecks on the https://test-platform.wafer.space to prod platform.","",""
"474048939897782314","itisyeetimetoday","2025-12-01T17:09:49.7140000+00:00","Oh what happened to sky90? If the google open souce pdk dead or is it the node being discontinued? Any hope for anything lower than 180 from global foundaries/tsmc/samsung/intel?","",""
"596068704471482370","246tnt","2025-12-01T17:12:37.0420000+00:00","@itisyeetimetoday The whole google involvment into open pdks ended before sky90 was ever released ... and without google's money, skywater has no interest in releasing their tech.","",""
"474048939897782314","itisyeetimetoday","2025-12-01T17:14:07.4060000+00:00","I see so sky130 was only open sourced beacause google paid a metric ton of cash? I'm guessing they paid GF for GF180MCU too, which probably means that we won't get any new open source nodes unless someone else steps up and pays for it?","",""
"596068704471482370","246tnt","2025-12-01T17:15:31.6410000+00:00","Well, IHP released their 130 nm node as an open pdk. (Although technically, that was funded by the German govt, but under ihp's initiative stiff IIUC).","",""
"474048939897782314","itisyeetimetoday","2025-12-01T17:15:58.9560000+00:00","I see, how does IHP 130nm stack up aginst sky130 for density and/or price?","",""
"596068704471482370","246tnt","2025-12-01T17:17:26.7020000+00:00","It's faster. It's not as dense as sky130 though, simply because the cell library available isn't optimized for density like the `hd` one from sky130.  Price is ~ 1500 EUR per sq mm for ~ 40 dies.","",""
"384390069412429834","polyfractal","2025-12-01T23:58:05.4350000+00:00","Think it would be possible to do a ""seamless"" tiling if you didn't need to dice the final wafer (and designed features large enough to overlap on the edges to account for overlay error)? or will foundries always enforce a certain border of dead space width around the die?

I guess you could just do a bunch of wirebonds between neighbors","",""
"756011607603019777","anfroholic","2025-12-02T00:26:46.4380000+00:00","These guys are trying that. Effectively the only thing between would be the metal layers for interconnect. 
https://www.cerebras.ai/chip","2025-12_media/image-3DDF7.png",""
"384390069412429834","polyfractal","2025-12-02T00:28:13.9480000+00:00","oh right, I forgot about them! will do some closer reading and see if I can glean any details

 I was noodling over some future projects that could be meshed with 1000 chips, and was like ""why don't I just leave them all on the wafer?"" 😇   I'm sure there are tons of weird issues like power distribution and timing and such, but could be a fun way to abuse an older node like 180nm","","waferspace (1)"
"805909190333038612","trev5514","2025-12-02T01:18:46.7370000+00:00","125 petaflops! WOW! My chip deisgn is an AI accelerator and I'm hoping to hit GOPS! That is unbelievable!","","👍 (1)"
"169786952432746498","mithro_","2025-12-02T03:44:49.3540000+00:00","I have thought about that idea too!","","😎 (1)"
"853313068871188530","peterkinget","2025-12-02T04:43:51.3480000+00:00","Hi Tim, excuse my ignorance, but where do we _test_ submit the design? I did it both on the test platform and platform.wafer.space. Going forward, can we just continue with platform.wafer.space?

Will someone communicate about the design after it goes through the pre-checks?

Thanks, -- Peter for MOSbiusV3","",""
"169786952432746498","mithro_","2025-12-02T06:16:30.6870000+00:00","An update should go out within 24h","",""
"384390069412429834","polyfractal","2025-12-02T17:09:20.1750000+00:00","Started a thread.","",""
"169786952432746498","mithro_","2025-12-02T23:22:12.2710000+00:00","How is everyone going today. I see a bunch of running prechecks on both test-platform and platform but not a massive queue. I also see a bunch of precheck successes.","",""
"1365118310701600900","rtimothyedwards_19428","2025-12-02T23:22:29.7120000+00:00","@Tholin :  Any chance I could get you to add a tristate inverter to your 3.3V standard cell set?","",""
"220639106915368960","tholin","2025-12-02T23:25:30.1460000+00:00","An inverter with a tri-state output enable?","",""
"1365118310701600900","rtimothyedwards_19428","2025-12-02T23:26:20.1580000+00:00","Yes, like `invz` in the `gf180mcu_fd_sc_mcu7t5v0` library.","",""
"220639106915368960","tholin","2025-12-02T23:26:29.8510000+00:00","That’s not too difficult","",""
"220639106915368960","tholin","2025-12-02T23:26:55.8900000+00:00","But lctime cannot characterize three-state output enables and I don’t think STA looks at them anyways.","",""
"1365118310701600900","rtimothyedwards_19428","2025-12-02T23:27:30.9840000+00:00","The characterization is not important to me;  I am using them in a ring oscillator that can't be simulated anyway.","",""
"220639106915368960","tholin","2025-12-02T23:27:39.7060000+00:00","You will have to do some SDC file trickery of your own","",""
"220639106915368960","tholin","2025-12-02T23:27:41.2480000+00:00","Ah","",""
"220639106915368960","tholin","2025-12-02T23:27:44.6670000+00:00","Okay","",""
"220639106915368960","tholin","2025-12-02T23:27:58.1960000+00:00","Are you still experimenting around with my SCL?","",""
"220639106915368960","tholin","2025-12-02T23:28:18.0510000+00:00","I pushed some updates fixing DRC issues to the repo just last week, I hope you saw.","",""
"1365118310701600900","rtimothyedwards_19428","2025-12-02T23:31:22.6290000+00:00","No, I didn't see, but updating is easy.  I need to start getting notifications on libraries that I am handling in open_pdks.","",""
"220639106915368960","tholin","2025-12-02T23:32:03.2360000+00:00","Unfortunately, I did not get characterizations at other corners done in time. Please add healthy setup and slack margins to your librelane configs.","",""
"169786952432746498","mithro_","2025-12-02T23:34:24.7360000+00:00","@Tim Edwards - You can ask GitHub to notify you on any activity on a repository.. Don't know if that helps.","",""
"1187141985530818611","ravenslofty","2025-12-03T00:19:26.8190000+00:00","My ISP is down for maintenance; wonderful timing.","",""
"1187141985530818611","ravenslofty","2025-12-03T14:49:29.9180000+00:00","@Tim 'mithro' Ansell do we get assigned a project ID, or is this a freeform field? it's unclear from the ""create new project"" form","",""
"323371864074485771","mole99","2025-12-03T14:50:55.0470000+00:00","You should be able to choose your own ID.","",""
"1187141985530818611","ravenslofty","2025-12-03T14:51:28.7220000+00:00","`CHES` it is then.","","🔥 (1)"
"169786952432746498","mithro_","2025-12-03T14:54:21.5990000+00:00","They have to be unique per shuttle, 4 letters/numbers and you can have [A-Z0-9]","",""
"169786952432746498","mithro_","2025-12-03T15:00:02.2710000+00:00","Well it's bed time for me.","",""
"1401841055975870476","scafir","2025-12-03T15:42:32.4660000+00:00","Hey, I see that pre-filled file url for the design file submission on platform.wafer.space is branch referred  (`github.com/[...]/blob/main/[...]`). It could be a bit dangerous to use it as such, as they may change with time. For example, if some error is found in the precheck and there's a need to update it and rerun the check, the files may not be same anymore.
A simple fix would be to encourage users to update files that are commit-referred instead, like `github.com/[...]/blob/39306415f62fd6e74851dbc5f0dc57ea608af3f3/[...]`, which are static","",""
"220639106915368960","tholin","2025-12-03T17:19:18.1630000+00:00","Antenna DRC clean?","",""
"220639106915368960","tholin","2025-12-03T17:19:19.1800000+00:00","Oh no","",""
"220639106915368960","tholin","2025-12-03T17:19:36.1190000+00:00","That’s not good for me","",""
"220639106915368960","tholin","2025-12-03T17:20:05.9590000+00:00","I have no standard cell grid in the top level, so no antenna cells can be inserted.","",""
"596068704471482370","246tnt","2025-12-03T18:30:59.7560000+00:00","Yeah, same ...","",""
"220639106915368960","tholin","2025-12-03T19:55:17.6560000+00:00","What do I even do when this happens? What config changes can I make?","2025-12_media/image-078B0.png",""
"596068704471482370","246tnt","2025-12-03T20:40:10.8300000+00:00","Supposedly OpenROAD now supports resolving antenna violation using higer layer strapping but I didn't search yet how to do that / configure it / ...","",""
"596068704471482370","246tnt","2025-12-03T20:40:18.3920000+00:00","That's on my todo for tomorrow.","",""
"738396032295108721","bailey8889","2025-12-03T20:47:21.1240000+00:00","@Tholin @tnt Does your design use macros? 

These are just guesses. It would be nice to know if anything made a difference.

If it does, you might try the `DIODE_ON_PORTS` parameter. 

If those are fanout related, make sure `DESIGN_REPAIR_TIE_FANOUT` is set to true.

Maybe adjust the `DESIGN_REPAIR_MAX_CAP_PCT` setting. Maybe counter-intuitive, but a higher setting may decrease the ratio by increasing the gate area. On the other hand, a lower setting may, decrease the wiring area.","",""
"738396032295108721","bailey8889","2025-12-03T20:49:08.8920000+00:00","or https://discord.com/channels/1361349522684510449/1445797038863155381/1445868913744150660","",""
"596068704471482370","246tnt","2025-12-03T20:57:09.7920000+00:00","@bailey I have diodes on all input ports of my macro. The violations are on wires going to the IO pads because the IO pads input don't have diodes I guess.","",""
"738396032295108721","bailey8889","2025-12-03T21:05:15.4580000+00:00","There's a setting for `both` for `DIODE_ON_PORTS`. Does that make a difference/something you want?","",""
"220639106915368960","tholin","2025-12-03T21:13:05.0900000+00:00","All my config changes make it worse. How am I expected to get 0 violations here?","2025-12_media/image-0FF89.png","🤔 (1)"
"169786952432746498","mithro_","2025-12-03T22:17:06.8260000+00:00","How is everyone going this morning?","","🤣 (1)"
"169786952432746498","mithro_","2025-12-03T22:17:31.8110000+00:00","Are these digital designs?","",""
"169786952432746498","mithro_","2025-12-03T22:18:57.0030000+00:00","We ***do*** require you to submit a hash for the gds/oas. Probably still worth submitting a GitHub issue about it.","",""
"220639106915368960","tholin","2025-12-03T22:22:24.0640000+00:00","Yes","",""
"169786952432746498","mithro_","2025-12-03T22:24:14.9970000+00:00","Couple of things -- If OpenROAD is having trouble closing on any of your designs, we should get them into the upstream OpenROAD benchmark test suite.","",""
"169786952432746498","mithro_","2025-12-03T22:25:30.9680000+00:00","What config are you using? I assume you have pushed this design somewhere?","",""
"384390069412429834","polyfractal","2025-12-03T22:26:17.1530000+00:00","@Tim 'mithro' Ansell trying to submit a new GDS url with new hashes, but it appears to be using the hashes from prior upload. any ideas?","",""
"384390069412429834","polyfractal","2025-12-03T22:27:36.9080000+00:00","ah, reloading and restarting the flow worked","",""
"220639106915368960","tholin","2025-12-03T22:28:06.7330000+00:00","https://github.com/AvalonSemiconductors/ws-submission-2025/tree/main/macros/SID","",""
"220639106915368960","tholin","2025-12-03T22:28:23.9020000+00:00","Here I go, pushing OpenROAD to its limits again...","","💜 (2)"
"169786952432746498","mithro_","2025-12-03T22:30:11.2730000+00:00","Like all the best people!","",""
"1365118310701600900","rtimothyedwards_19428","2025-12-03T22:51:26.5520000+00:00","@Tholin :  And I'm pushing your library to the limits.  Now I need an asynchronous set/reset flop in addition to the tristate inverter.  If you haven't worked on the tristate buffer at all, then I will probably try to do both of those tomorrow, along with any others that might be useful (oai?  nand4/nor4?).  But probably just the flops and tristate inverter will get me through synthesis.","",""
"169786952432746498","mithro_","2025-12-03T22:53:00.1400000+00:00","","",""
"169786952432746498","mithro_","2025-12-03T22:53:00.9020000+00:00","@Tholin - Maybe the following could help?","",""
"220639106915368960","tholin","2025-12-03T23:27:20.6080000+00:00","Unfortunately, I will now be busy fixing antenna violations in almost all of my designs.","",""
"220639106915368960","tholin","2025-12-03T23:27:34.0460000+00:00","All but like one or two of them have at least one violation.","",""
"220639106915368960","tholin","2025-12-03T23:32:43.4550000+00:00","Even the multiplexer!","",""
"220639106915368960","tholin","2025-12-03T23:36:51.2560000+00:00","This fixes the antenna violations but generates LVS errors.","",""
"220639106915368960","tholin","2025-12-03T23:41:02.1920000+00:00","Ah, because the config lines you showed me add the diodes *after* detailed routing. I guess its supposed to be before?","",""
"169786952432746498","mithro_","2025-12-03T23:41:40.7460000+00:00","I don't really know anything, I just forward messages between people 😛","",""
"220639106915368960","tholin","2025-12-03T23:42:13.6710000+00:00","I am trying
```
  substituting_steps:
    +OpenROAD.RepairAntennas: Odb.InsertECODiodes
```
and I’ll report back in ~30 minutes","",""
"1187141985530818611","ravenslofty","2025-12-03T23:42:30.3680000+00:00","So, platform.wafer.space says it supports Google Drive, but I attach a google drive link and it reports `Security validation failed: URL validation failed: Invalid file size: 0 bytes `","",""
"1187141985530818611","ravenslofty","2025-12-03T23:43:17.1700000+00:00","uh, I think you might need to run `OpenROAD.DetailedRouting` after that","",""
"169786952432746498","mithro_","2025-12-03T23:46:42.1110000+00:00","Can you create a GitHub Issue about that?","",""
"220639106915368960","tholin","2025-12-04T00:19:26.1800000+00:00","Stuck","2025-12_media/image-D5987.png",""
"1187141985530818611","ravenslofty","2025-12-04T00:20:14.6830000+00:00","I suspect when mine comes around I might end up holding everyone else up >.>","",""
"220639106915368960","tholin","2025-12-04T01:18:27.3510000+00:00","Got another fun one. If you run the flow on this with its exact config, it’ll fail GLP with `[GPL-0305] RePlAce diverged during gradient descent calculating, resulting in an invalid step length (inf or NaN).` but if the max fanout constraint in the config is changed from 7 to 6, it passes (before failing due to routing congestion).
Maybe also a fun benchmark case.","2025-12_media/example.tar-E5614.gz",""
"805909190333038612","trev5514","2025-12-04T01:21:49.4380000+00:00","A month ago I was trying different fanout constraints and it caused so many headaches with that exact error message. I went back to the standard and didn't have any issues since then.","",""
"169786952432746498","mithro_","2025-12-04T01:22:57.9580000+00:00","I'm pretty sure that should be a bug reported upstream.","",""
"805909190333038612","trev5514","2025-12-04T01:24:45.0650000+00:00","@Tim 'mithro' Ansell My last gds run on the test-platform.wafer.space website stalled after 3 hours. The same design ran on my computer for over 8 hours and didn't finish. Does the platform.wafer.space have longer run capability?","",""
"805909190333038612","trev5514","2025-12-04T01:28:42.7090000+00:00","I believe I reported to the project template, in hindsight I believe it's an upstream issue.

 https://github.com/wafer-space/gf180mcu-project-template/issues/5","",""
"169786952432746498","mithro_","2025-12-04T01:35:26.6720000+00:00","I see some people have prechecks running at the +12 hours","","👍 (1)"
"169786952432746498","mithro_","2025-12-04T01:38:13.8820000+00:00","","2025-12_media/image-5DAE1.png",""
"220639106915368960","tholin","2025-12-04T01:42:05.5410000+00:00","That doesn't seem right","",""
"220639106915368960","tholin","2025-12-04T01:42:29.6190000+00:00","My die is packed and it doesn't take nearly as long","",""
"220639106915368960","tholin","2025-12-04T01:43:05.1060000+00:00","A 0.5x1 slot taking 12 hours feels like something got stuck","",""
"805909190333038612","trev5514","2025-12-04T01:45:08.7650000+00:00","","",""
"805909190333038612","trev5514","2025-12-04T01:45:09.1340000+00:00","Maybe not... I don't know how large this design was but if it's more complex than this then I could believe it.","",""
"169786952432746498","mithro_","2025-12-04T02:18:33.0590000+00:00","At some point in the near future, I'll decomission https://test-platform.wafer.space and then set it up to provide extra precheck workers for https://platform.wafer.space","",""
"169786952432746498","mithro_","2025-12-04T02:25:31.8540000+00:00","","2025-12_media/image-C35DA.png",""
"169786952432746498","mithro_","2025-12-04T02:26:21.0820000+00:00","Looks like there are still a few that need to be ported across from test-platform?","2025-12_media/image-CE35D.png","👍 (1)"
"384390069412429834","polyfractal","2025-12-04T04:12:36.4700000+00:00","the deadline is just ""have a GDS in the queue"" right?  we can continue to update the design through next week due to the upcoming DRC changes?","",""
"323371864074485771","mole99","2025-12-04T05:53:13.5090000+00:00","Yes","","👍 (2)"
"169786952432746498","mithro_","2025-12-04T06:40:34.7920000+00:00","You may have trouble logging into the https://platform.wafer.space but you should be able to reset the password via email. I was transfering users from test-platform.wafer.space but the passwords for email based login are hashed in a way they don't transfer.","","👍 (1)"
"169786952432746498","mithro_","2025-12-04T07:00:53.1870000+00:00","Anyone need anything from me/waiting on anything from me at the moment? (Apart from looking into the DRC check queue on platform.wafer.space?)","",""
"1365118310701600900","rtimothyedwards_19428","2025-12-04T21:06:06.3230000+00:00","@Tholin :  I don't know if you have time to do anything with these, but here are layouts for a set-reset flop and a tristate inverter.  I think these two will be sufficient for my needs.","2025-12_media/gf180mcu_as_sc_mcu7t3v3__dfsrtp_2-F511B.mag,2025-12_media/gf180mcu_as_sc_mcu7t3v3__invz_2-356B8.mag",""
"1365118310701600900","rtimothyedwards_19428","2025-12-04T21:08:24.5690000+00:00","The `invz` cell is the equivalent of the GF 5V 7 track cell of the same name (I changed pin names to match your conventions), and the `dfsrtp` cell is the equivalent of the GF 5V 7 track cell `gf180mcu_fd_sc_mcu7t5v0__dffrsnq_2`.","",""
"1365118310701600900","rtimothyedwards_19428","2025-12-04T21:54:10.1490000+00:00","I have also created all the views (GDS, CDL, LEF, verilog, and a liberty file just copied from the original) and can provide a gzipped tarball if needed.","",""
"169786952432746498","mithro_","2025-12-04T22:24:43.5010000+00:00","","2025-12_media/image-B9D26.png",""
"596068704471482370","246tnt","2025-12-04T22:28:21.8880000+00:00","The half width looks higher than the full in that diagram.","","😮 (1)"
"220639106915368960","tholin","2025-12-04T23:10:08.8700000+00:00","I am still fighting antenna violations","",""
"220639106915368960","tholin","2025-12-04T23:10:13.6760000+00:00","Each of my individual macros now has none","",""
"220639106915368960","tholin","2025-12-04T23:10:20.4800000+00:00","But the top level does!","2025-12_media/image-48CA3.png",""
"220639106915368960","tholin","2025-12-04T23:11:26.2190000+00:00","I really don’t want to have to insert a standard cell grid into this.","",""
"220639106915368960","tholin","2025-12-04T23:11:55.6950000+00:00","The problem appears to be that the iopads don’t have diodes.","",""
"169786952432746498","mithro_","2025-12-04T23:30:09.6950000+00:00","@Tholin - I think @tnt is fighting with similar problem on Tiny Tapeout?","",""
"220639106915368960","tholin","2025-12-04T23:34:08.7100000+00:00","I have a stupid idea on how to fix this, but if it works it works.","",""
"220639106915368960","tholin","2025-12-04T23:34:50.1880000+00:00","But for the next shuttle, we should consider modifying the IO cells to have diodes on the Y output.","",""
"220639106915368960","tholin","2025-12-05T00:59:31.2330000+00:00","I forgot diodes on ports on one of my macros. No more antenna violations after detailed routing. Lets hope KLayout doesn’t find anything either.","",""
"1187141985530818611","ravenslofty","2025-12-05T01:03:01.5110000+00:00","you're using a custom standard cell library for your design, right?","",""
"220639106915368960","tholin","2025-12-05T01:03:08.9710000+00:00","No","",""
"1187141985530818611","ravenslofty","2025-12-05T01:05:00.0540000+00:00","well, I wanted to ask some questions about <https://github.com/AvalonSemiconductors/gf180mcu_as_sc_mcu7t3v3>, but I guess they don't matter then","",""
"169786952432746498","mithro_","2025-12-05T01:30:46.6090000+00:00","","",""
"169786952432746498","mithro_","2025-12-05T01:41:14.1050000+00:00","I believe @Tim Edwards is using them in some way?","",""
"596068704471482370","246tnt","2025-12-05T07:12:10.2060000+00:00","They're fixed now. KLayout still shows some violations with the default deck, but I believe this to be a bug in the KLayout antenna deck. When I change it to what I think it should be according to the docs, then it passes.","",""
"1446100763364425729","securitybrahh","2025-12-05T07:18:48.4740000+00:00","https://github.com/securitybrahh/open-source-asic-bitcoin-chip-sha256/","",""
"1446100763364425729","securitybrahh","2025-12-05T07:19:30.7460000+00:00","Hi I am trying to design an open source ASIC for bitcoin miner.

Can someone guide me how to design and send the project for manufacturing?","",""
"1446100763364425729","securitybrahh","2025-12-05T07:20:01.6220000+00:00","So should I make wokwi and siliwiz projects?","",""
"220639106915368960","tholin","2025-12-05T09:10:57.6780000+00:00","Why am I getting 596 CUP.3 errors?","",""
"323371864074485771","mole99","2025-12-05T09:14:54.7520000+00:00","Please see the latest announcement in #📝-project-template","",""
"220639106915368960","tholin","2025-12-05T09:16:20.0180000+00:00","I did update the PDK","",""
"323371864074485771","mole99","2025-12-05T09:17:52.2210000+00:00","And you regenerated the padring with the updated pad library?","",""
"220639106915368960","tholin","2025-12-05T09:20:08.3500000+00:00","Were my analog pad changes upstreamed? Otherwise, I still have to rely on my modded analog pads for DRT to function.","",""
"323371864074485771","mole99","2025-12-05T09:22:47.8970000+00:00","Have you submitted an upstream patch?","",""
"323371864074485771","mole99","2025-12-05T09:22:54.3110000+00:00","The changes only affect the GDS, so you can keep your changes to the LEF.","",""
"220639106915368960","tholin","2025-12-05T09:23:32.0250000+00:00","No, I don’t know how to do this properly. Modifying the existing cell seems difficult because of how its all crammed into one GDSII file and then referenced by precise byte offsets in the mag files.","",""
"220639106915368960","tholin","2025-12-05T09:26:14.2940000+00:00","I added a pin as well","",""
"220639106915368960","tholin","2025-12-05T09:26:31.3050000+00:00","DRT seems to like it when there is a ""PAD"" pin separate from ASIG5V even though they are both the same","",""
"323371864074485771","mole99","2025-12-05T09:28:44.7610000+00:00","The GDS of the foundry pad library has already been adjusted for CUP.3.
So far magic streamout and the following XOR with KLayout seem to be successful. So perhaps no changes to the mag files are necessary?","",""
"220639106915368960","tholin","2025-12-05T09:30:30.7960000+00:00","I had to add a pin to the analog cell, so that implies a mag file change for sure","",""
"220639106915368960","tholin","2025-12-05T09:31:15.5370000+00:00","I’m also talking about this at the end of every mag file. Updating the GDSII would have to update these lines in ALL mag files, as the byte offsets change.","2025-12_media/image-653F2.png",""
"220639106915368960","tholin","2025-12-05T09:31:40.7360000+00:00","Maybe you got lucky since all you did was adjust some polygons","",""
