AuthorID,Author,Date,Content,Attachments,Reactions
"220639106915368960","tholin","2025-12-05T09:31:45.3440000+00:00","Or maybe this information isn’t used","",""
"220639106915368960","tholin","2025-12-05T09:31:48.3420000+00:00","But I don’t know","",""
"596068704471482370","246tnt","2025-12-05T09:39:19.0920000+00:00","I don't think it's used in the default flow, but updating it is definitely needed to not have invalid cross references in the PDK.","",""
"596068704471482370","246tnt","2025-12-05T09:39:50.0670000+00:00","And given the GDS changed size, those offsets have definitely changed so the current PDK has incoherent views which is not good.","",""
"220639106915368960","tholin","2025-12-05T09:42:35.5580000+00:00","This is why, for all my SCLs, I generate separate GDSII files for each cell. Its a lot more files and looks like a mess, but its impossible to accidentally have everything suddenly have an invalid reference.","",""
"220639106915368960","tholin","2025-12-05T09:42:53.2810000+00:00","I....don’t know how they even generated those byte offsets in the first place.","",""
"596068704471482370","246tnt","2025-12-05T09:43:38.2100000+00:00","You just do `gds readonly true` / `gds read xxx.gds` / `writeall`  and this will rewrite mag views for all the cells in the GDS that was read.","",""
"323371864074485771","mole99","2025-12-05T09:44:32.8360000+00:00","Thanks, I see! I'll update the mag files soon.","",""
"596068704471482370","246tnt","2025-12-05T09:46:22.4470000+00:00","I'm not sure how the `maglef` are done. But @Tim Edwards would know 😅","",""
"596068704471482370","246tnt","2025-12-05T09:46:42.7180000+00:00","maybe just reading the lef views before the GDS ?","",""
"220639106915368960","tholin","2025-12-05T09:46:43.1570000+00:00","...what?","2025-12_media/image-AEC6A.png",""
"220639106915368960","tholin","2025-12-05T09:46:48.4030000+00:00","I think my project is cursed","",""
"220639106915368960","tholin","2025-12-05T09:46:59.6810000+00:00","Haunted, even","",""
"596068704471482370","246tnt","2025-12-05T09:47:48.1580000+00:00","Is that using your IO ? Or the default one ?","",""
"220639106915368960","tholin","2025-12-05T09:47:56.5630000+00:00","Default, but I applied some of my LEF changes","",""
"220639106915368960","tholin","2025-12-05T09:59:33.0620000+00:00","Reverted those changes, still fails","",""
"220639106915368960","tholin","2025-12-05T10:03:44.5880000+00:00","Disregard, I forgot to hit save in the text editor.","",""
"738396032295108721","bailey8889","2025-12-05T10:04:11.9620000+00:00","BTDT","",""
"596068704471482370","246tnt","2025-12-05T10:19:51.2640000+00:00","Hard to tell because I'm looking at 2 days old version, but your chip top level should have corresponding `inout` for the analog signals and those should be connected to your newly defined `PAD` signal on the analog pins.","",""
"220639106915368960","tholin","2025-12-05T11:43:32.0210000+00:00","I turned the standard cell grid back on so that antennas can be inserted, and even though DRT finishes with 0 antenna violations, KLayout still finds 175 problems. What do I do?","",""
"596068704471482370","246tnt","2025-12-05T11:46:18.7920000+00:00","Are you running the latest PDK update ?","",""
"596068704471482370","246tnt","2025-12-05T11:46:50.1640000+00:00","There was a fix for KLayout antenna check ~ 1.5h ago.","",""
"220639106915368960","tholin","2025-12-05T11:55:39.7310000+00:00","Oh, right","",""
"220639106915368960","tholin","2025-12-05T11:55:47.5570000+00:00","I started this flow before then","",""
"220639106915368960","tholin","2025-12-05T11:55:51.9680000+00:00","That’s how long it takes!","",""
"220639106915368960","tholin","2025-12-05T11:57:49.6600000+00:00","@Tim Edwards invz_2 has been added to my SCL. DFFs take a while, its over an hour to run all the simulations.","",""
"596068704471482370","246tnt","2025-12-05T12:03:03.0600000+00:00","Yeah, precheck we started 6h ago just finished for TT 😅","",""
"220639106915368960","tholin","2025-12-05T12:05:49.0910000+00:00","Only after doing `rm -rf librelane/runs && make librelane` did it occur to me that I could’ve just re-run the antenna check on the existing GDSII...","",""
"596068704471482370","246tnt","2025-12-05T12:10:12.2540000+00:00","😬","",""
"220639106915368960","tholin","2025-12-05T13:05:16.4280000+00:00","@Tim Edwards Both cells are now in the library. Have fun!","","👍 (1),🎉 (1)"
"220639106915368960","tholin","2025-12-05T13:36:48.1940000+00:00","With the new PDK. NOW what do I do?","2025-12_media/image-C60A6.png",""
"220639106915368960","tholin","2025-12-05T13:40:42.0030000+00:00","Antenna repair doesn’t pick up on these.","",""
"220639106915368960","tholin","2025-12-05T13:40:54.2150000+00:00","The antenna check after DRT says nothing’s wrong.","",""
"709384666909507634","egorxe","2025-12-05T13:45:22.9440000+00:00","There is currently an ongoing work to correct KLayout antenna checks, it could be due to this. See latest merged & unmerged PRs in the [PDK repo](https://github.com/wafer-space/gf180mcu/pulls?q=is%3Apr).","",""
"220639106915368960","tholin","2025-12-05T13:46:11.7610000+00:00","I thought that already was merged?","",""
"220639106915368960","tholin","2025-12-05T13:47:37.6360000+00:00","Aaaand analog pads once again don’t route","2025-12_media/image-8A4F9.png",""
"709384666909507634","egorxe","2025-12-05T13:54:41.5560000+00:00","The latest PR from Leo relaxing overly strict Klayout antenna checks (considering whole diode area) [was merget 4 hours ago](https://github.com/wafer-space/gf180mcu/pull/13). Do you have it in already? There is also one from me which is still not merged, but it will make KLayout checks more strict due to proper Metal5 thickness, so it does not look like your problem.","",""
"220639106915368960","tholin","2025-12-05T14:05:37.6960000+00:00","@Leo Moser (mole99) I tried this and it appears to not generate `LEFclass`, `LEFsite` and `LEFsymmetry` properties, so ensure they are preserved from the old mag files.","",""
"323371864074485771","mole99","2025-12-05T14:08:31.1640000+00:00","I think you have to annotate the GDS with the LEF files? I'm not sure as I haven't done this before.
Perhaps @Tim Edwards could comment on this.","",""
"220639106915368960","tholin","2025-12-05T14:22:46.5290000+00:00","Also, I am definitely on the new antenna DRC script. I even checked the actual file and it matches.","",""
"220639106915368960","tholin","2025-12-05T14:23:04.1140000+00:00","Still getting antenna violations that LibreLane isn’t picking up on and repairing.","",""
"323371864074485771","mole99","2025-12-05T14:47:51.7510000+00:00","The final antenna summary in OpenROAD does not show these violations? If that is the case, can you load the marker database in KLayout to see which nets are affected?","",""
"596068704471482370","246tnt","2025-12-05T15:07:12.9010000+00:00","@Tholin If you can post the GDS and XML report, I can have a look.","",""
"596068704471482370","246tnt","2025-12-05T15:11:00.0690000+00:00","@Leo Moser (mole99) Actually now that I think about it, generating the mag/maglef is probably done as an install step of open_pdks ...","",""
"596068704471482370","246tnt","2025-12-05T15:14:46.7970000+00:00","Yeah, there is some magic stuff but also some python scripting to generate the mag/maglef from the GDS.","","👌 (1)"
"709384666909507634","egorxe","2025-12-05T15:41:28.0250000+00:00","BTW, @Tholin you're using your own 3.3V cell library in LibreLane right? What value do you use for ANTENNAGATEPLUSDIFF in your techlefs?","",""
"596068704471482370","246tnt","2025-12-05T15:44:49.1130000+00:00","@Egor Lukyanchenko He is not.","","👌 (1)"
"1365118310701600900","rtimothyedwards_19428","2025-12-05T16:19:11.4000000+00:00","@Leo Moser (mole99) @Tholin :  The LEF parameters can be set with the ""property"" command in magic by hand, or you can just read LEF on top of an existing layout, if you have the LEF already, and it will generate the properties for you.  Be careful when you do that, because it will also try to relabel everything according to the ports in the LEF file.  That may be what you want, then again, it might not.","","👍 (1)"
"1152597572385525871","jonathan_ha_25034","2025-12-05T16:19:51.6500000+00:00","Switching to the development version of librelane might be worth a try to see if something changes. I had similar issues with antenna violations within the macros of our design. You could try to get the librelane dev version with
```
nix shell github:librelane/librelane/dev
```
and then run the synthesis flow with
```make
librelane librelane/config.yaml --pdk ${PDK} --pdk-root ${PDK_ROOT}
```.
Set PDK_ROOT to some directory and then Librelane should download the PDK. At least for me this yielded better results that helped me debug the design","",""
"709384666909507634","egorxe","2025-12-05T16:35:04.2700000+00:00","Allowing Librelane to download a PDK is probably not a good idea, as it will download it using ciel and for gf180mcu it will be outdated.","",""
"220639106915368960","tholin","2025-12-05T16:44:41.8810000+00:00","I don’t know how to do this.","",""
"220639106915368960","tholin","2025-12-05T16:44:50.9090000+00:00","Trying to figure it out","",""
"220639106915368960","tholin","2025-12-05T16:45:14.6070000+00:00","But also, manually checking the coordinates a few times, its almost all on bidir_PAD2CORE lines","",""
"220639106915368960","tholin","2025-12-05T16:47:30.2170000+00:00","Here we are","2025-12_media/image-C89C0.png",""
"1187141985530818611","ravenslofty","2025-12-05T16:48:24.9990000+00:00","that's why there's the `--manual-pdk` option to librelane","",""
"323371864074485771","mole99","2025-12-05T17:05:48.4180000+00:00","About my previous question: Does the final antenna summary in OpenROAD show these violations?
Because if it does, we just need to convince LibreLane to fix them in some way. If not, then we have a mismatch between OpenROAD's and KLayout's definition of antenna violations.","",""
"220639106915368960","tholin","2025-12-05T17:10:53.4140000+00:00","","2025-12_media/image-8DEB0.png","🎉 (2)"
"709384666909507634","egorxe","2025-12-05T17:23:25.6030000+00:00","If there were no such discrepancies previously , it most likely means that it appeared due to increase in ANTENNAGATEPLUSDIFF, as OR is not overfixing with diodes anymore. If it so, it means that the mismatch is most likely related to diodes, not metals.","",""
"596068704471482370","246tnt","2025-12-05T17:29:15.1010000+00:00","@Leo Moser (mole99) Yes, discrepency is what I'd like to check. But I'm wondering if being perfect is even possible since the LEF contains only the total gate/diff are and no information about the layers to reach that gate/diff area so I'm not sure OpenROAD can always be correct.","",""
"596068704471482370","246tnt","2025-12-05T17:29:30.9080000+00:00","But I'd need to analyze the final GDS to test that theory.","",""
"220639106915368960","tholin","2025-12-05T17:29:57.4340000+00:00","So, I have KLayout antenna violations on wires that go in-between macros. I have antennas on all macro ports. So a wire with antennas on both ends is getting an antenna violation. Is that even possible?","",""
"220639106915368960","tholin","2025-12-05T17:30:23.6630000+00:00","Like, the standard cell, I mean.","",""
"596068704471482370","246tnt","2025-12-05T17:31:09.5480000+00:00","Yes, it's possible.","",""
"596068704471482370","246tnt","2025-12-05T17:31:44.6900000+00:00","Depending on routing layers, that diode could be useless.","",""
"220639106915368960","tholin","2025-12-05T17:32:30.6530000+00:00","https://files.tholin.dev/Public/GDSII/chip_top.tar.gz","",""
"596068704471482370","246tnt","2025-12-05T17:33:15.4500000+00:00","When OpenROAD inserts a diode, it takes care to put it close to where the gate to protect is. But when you manually instanciate one, OpenROAD just sees that as ""just another standard cell"" and will place it where ever convenient.

In tiny tapeout I was instanciating diodes, and I had to write a custom script to manually re-position those diode where appropriate so they are effective to fix some of my violations.","",""
"596068704471482370","246tnt","2025-12-05T17:34:27.9190000+00:00","If you're manually instanciating diodes, you could instead try to use this : https://openlane2.readthedocs.io/en/latest/reference/step_config_vars.html#diodes-on-ports-protection-routine  which should also take care of placing them well.","",""
"220639106915368960","tholin","2025-12-05T17:35:02.9420000+00:00","I have DIODE_ON_PORTS: both in all my flows","",""
"596068704471482370","246tnt","2025-12-05T17:35:13.6260000+00:00","Ah ok, nevermind then 😅","",""
"596068704471482370","246tnt","2025-12-05T17:35:48.6560000+00:00","Could you post the antenna report xml too so I don't have to run it 😅","",""
"220639106915368960","tholin","2025-12-05T17:40:07.2070000+00:00","","2025-12_media/antenna.klayout-D527C.lyrdb","👌 (1)"
"709384666909507634","egorxe","2025-12-05T17:49:27.9140000+00:00","Diodes on output ports of macros do not help much as there is quite low probability of them being connected to the receiving gate without going ""up"" through the metal stack.","",""
"596068704471482370","246tnt","2025-12-05T17:52:55.9320000+00:00","Mmm, something is weird. Beause I picked a random violation and looked at it and it didn't properly account for the input protection diode that's present in the IO cell.","",""
"596068704471482370","246tnt","2025-12-05T17:53:10.1360000+00:00","Are you sure that was run with the latest PDK ?","",""
"596068704471482370","246tnt","2025-12-05T17:56:07.4100000+00:00","it measures perimeter at 2139  and gate area at 3.15 ( and those looks correct ) and report ratio as 679 ( so indeed a violation ).   But there is a 1 um^2 diode that's propertly connected by a lower metal layer so this should make the effective gate area 3.15 + 15 * 1 = 18.15 and the ratio 117 which is well below the error threshold.","",""
"220639106915368960","tholin","2025-12-05T17:57:34.4660000+00:00","1.4.1?","",""
"596068704471482370","246tnt","2025-12-05T17:57:58.7600000+00:00","yes.","",""
"220639106915368960","tholin","2025-12-05T17:58:15.0740000+00:00","That’s the tag I got checked out","",""
"220639106915368960","tholin","2025-12-05T17:59:16.0710000+00:00","But I see there have been antenna-check related commits since then","",""
"220639106915368960","tholin","2025-12-05T18:01:04.3060000+00:00","I will pull the latest and try to run the check again, since I have nothing better to try.","",""
"1365118310701600900","rtimothyedwards_19428","2025-12-05T18:03:03.4430000+00:00","@Tholin :  What am I missing here?
```
ABC: Setting driving cell to be ""gf180mcu_as_sc_mcu7t3v3__inv_2/Y"".
ABC: Setting output load to be 72.910004.
ABC: + source /home/tim/gits/gf180mcu_ocd_openframe/librelane/runs/RUN_2025-12-05_13-00-18/06-yosys-s
ynthesis/AREA_0.abc
ABC: Error: The network is combinational.
ABC: Cannot find the default PI driving cell (gf180mcu_as_sc_mcu7t3v3__inv_2/Y) in the library.
```","",""
"220639106915368960","tholin","2025-12-05T18:08:56.9940000+00:00","I don’t know","",""
"220639106915368960","tholin","2025-12-05T18:09:04.7330000+00:00","Its not happening on my end either","",""
"220639106915368960","tholin","2025-12-05T18:10:09.2720000+00:00","So I can’t replicate the issue","",""
"1365118310701600900","rtimothyedwards_19428","2025-12-05T18:11:52.0080000+00:00","Okay, actually that's good to know;  it's probably something in my code, then.","",""
"1365118310701600900","rtimothyedwards_19428","2025-12-05T18:21:24.4580000+00:00","It did not like synthesizing my ring oscillator, which I guess shouldn't surprise me.","",""
"220639106915368960","tholin","2025-12-05T19:13:13.1260000+00:00","Nope. Still getting antenna violations.","",""
"596068704471482370","246tnt","2025-12-05T19:29:02.1190000+00:00","Yeah ... there is still a bug in the deck 😅","",""
"596068704471482370","246tnt","2025-12-05T19:29:20.9380000+00:00","`n_diode | n_diode` ... cc @Leo Moser (mole99)","","😢 (1)"
"323371864074485771","mole99","2025-12-05T19:29:46.5450000+00:00","🤦‍♂️","","😢 (1)"
"323371864074485771","mole99","2025-12-05T19:29:58.3340000+00:00","Thanks, fixing now...","",""
"220639106915368960","tholin","2025-12-05T19:31:42.2320000+00:00","Oh","",""
"220639106915368960","tholin","2025-12-05T19:31:43.3890000+00:00","Well","",""
"220639106915368960","tholin","2025-12-05T19:32:04.9140000+00:00","I guess I can undo all the changes I’ve been making to my project to try and fix this.","",""
"323371864074485771","mole99","2025-12-05T19:34:20.1110000+00:00","https://github.com/wafer-space/gf180mcu/releases/tag/1.4.4","",""
"1365118310701600900","rtimothyedwards_19428","2025-12-05T20:13:13.2360000+00:00","@Leo Moser (mole99):  I'm getting an error
```
 No libs found for macro                                    flow.py:698
                    gf180mcu_ocd_ip_sram__sram256x8m8wm1 at corner
                    max_ff_n40C_5v50. The module will be black-boxed.
```
But I am not specifying 5V anywhere.  Where is this corner name coming from?  My MACROS section specifies the .lib files for the SRAMs as, e.g., `tt_025C_3v30`.","",""
"1365118310701600900","rtimothyedwards_19428","2025-12-05T20:24:13.4420000+00:00","(Also it seems to be looking for 5V .lib files for the standard cells as well, and of course can't find any.)","",""
"323371864074485771","mole99","2025-12-05T20:25:53.3760000+00:00","The LibreLane config in the PDK defines the various corners. You can override this from your config like so: https://github.com/splinedrive/gf180mcu-kianv-rv32ima-sv32/blob/4da6d0129e7d52011066a0dd335faa4a0551ebb8/librelane/config.yaml#L172
Make sure to change `STA_CORNERS`, `LIB` and `DEFAULT_CORNER`.","",""
"323371864074485771","mole99","2025-12-05T20:26:29.1300000+00:00","If `LIB` is not set, the pdk_compat functionality in LibreLane will set it to these values: https://github.com/librelane/librelane/blob/d8b98532399f6eaa230e44e4a505bd653c10dd71/librelane/config/pdk_compat.py#L294","",""
"1365118310701600900","rtimothyedwards_19428","2025-12-05T20:42:32.3480000+00:00","@Leo Moser (mole99) :  Thanks, that worked for Stage 10 and got me through synthesis.  But I'm still getting the same message (as a warning, not an error) on the floorplanning (Stage 12), but only for the SRAM.  As it is a warning only, I'm going to assume it's okay unless I discover otherwise. . .","","👍 (1)"
"1187141985530818611","ravenslofty","2025-12-05T21:19:29.8670000+00:00","if I upload a new GDS to platform.wafer.space, do I lose my spot in the queue? ^^;","",""
"323371864074485771","mole99","2025-12-05T21:28:36.1010000+00:00","@Tim 'mithro' Ansell ^","",""
"1187141985530818611","ravenslofty","2025-12-05T21:31:54.3510000+00:00","because I've been trying to get antenna check to pass locally, and, uh","",""
"596068704471482370","246tnt","2025-12-05T21:36:37.1330000+00:00","@Tholin I ran new antenna check on the GDS you sent. It didn't fix all of them, but it fixed some at least.","",""
"1187141985530818611","ravenslofty","2025-12-05T21:45:23.7520000+00:00","answer: yes, you lose your spot in the queue","",""
"220639106915368960","tholin","2025-12-05T22:00:10.1180000+00:00","Yep. I’m down to 17 errors.","",""
"220639106915368960","tholin","2025-12-05T23:56:22.3490000+00:00","Uhhhhhhhh","2025-12_media/image-5334E.png",""
"220639106915368960","tholin","2025-12-05T23:57:14.1430000+00:00","I know what’s causing this, but its still funny.","",""
"220639106915368960","tholin","2025-12-06T00:05:09.7550000+00:00","But it appears we do have some discrepancies between OpenROAD and KLayout","",""
"738396032295108721","bailey8889","2025-12-06T00:36:05.5390000+00:00","Started a thread.","",""
"220639106915368960","tholin","2025-12-06T01:48:22.9730000+00:00","Wait","",""
"220639106915368960","tholin","2025-12-06T01:48:27.9520000+00:00","I messed something up","",""
"220639106915368960","tholin","2025-12-06T01:48:37.5770000+00:00","There is traces and standard cells clipping into my silicon art","",""
"220639106915368960","tholin","2025-12-06T01:48:57.4360000+00:00","That is a big yikes","",""
"220639106915368960","tholin","2025-12-06T01:49:14.4920000+00:00","Besides the DRC errors this brings, wanna bet its responsible for the false antenna positives?","",""
"1365118310701600900","rtimothyedwards_19428","2025-12-06T01:51:54.9940000+00:00","Maybe.  Top level metal is rarely involved in antenna violations because it is almost guaranteed to be connected to diffusion somewhere.  The only way to go is down.","",""
"220639106915368960","tholin","2025-12-06T02:04:19.7240000+00:00","I may or may not have duplicated the artwork pixels onto every metal layer, as well as Poly2","",""
"220639106915368960","tholin","2025-12-06T02:07:54.6670000+00:00","I have a fillblock over every piece of artwork because I am afraid of the fillers messing it up visually. So that’s why the artwork is on every layer. To prevent minimum density violations.","",""
"220639106915368960","tholin","2025-12-06T02:07:59.7990000+00:00","The art IS my fill pattern!","","💜 (1)"
"169786952432746498","mithro_","2025-12-06T02:10:52.0310000+00:00","I have to run very soon, but it looks like the prechecks are running okay on platform (even if there is still a bit of a queue) and are detecting antenna issues now?","",""
"169786952432746498","mithro_","2025-12-06T02:13:46.0810000+00:00","I didn't get a chance to deploy the functionality which lets me crank the number of simultaneous prechecks up yet but I think that will happen today.","",""
"169786952432746498","mithro_","2025-12-06T02:19:10.1930000+00:00","Also if you haven't already seen, there is a great post from Matt Venn @ https://www.zerotoasiccourse.com/post/excited_by_silicon/ about his thoughts on the state of open silicon.","","💜 (3)"
"1365118310701600900","rtimothyedwards_19428","2025-12-06T02:20:15.9100000+00:00","I feel like I am far behind in the race, but at least I got LibreLane to give me GDS of a synthesized layout of my 3.3V picoRV32 in a mixed voltage padframe using my SRAM and I/O and Tholin's standard cells (thanks, Tholin!).  I still have not worked on the power connections and there are other issues, and the whole thing is under-utilizing the space, but it is good progress!","2025-12_media/caravel_openframe-01168.png","❤️ (2),🎉 (3)"
"1365118310701600900","rtimothyedwards_19428","2025-12-06T02:28:59.8410000+00:00","@Tholin :  FYI:  I pulled your latest standard cell updates and obviously they worked because otherwise I would not have produced the pic above.  But for the record, you are missing the verilog for the two new cells (my version, attached).  Also, I noticed in the update that you renamed ""decap"" cells to ""fillcap"";  however, the setup file for LibreLane still calls out ""decap"" for the cells.","2025-12_media/gf180mcu_as_sc_mcu7t3v3__dfsrtp_2-19816.v,2025-12_media/gf180mcu_as_sc_mcu7t3v3__invz_2-7954E.v",""
"169786952432746498","mithro_","2025-12-06T05:25:11.2530000+00:00","@SecurityBrahh - Just so you have the right expectations, any ""bitcoin miner"" accelerator on GF180MCU is not going to be competitive in any way against the current miner ASICs that are available (I doubt it would even beat a modern CPU). If you are doing it as an academic/learning exercise or for prototyping or otherwise, it could still make sense to do.

Also doing a bitcoin miner isn't an easy task, I would not recommend it be your first ASIC or tapeout. You are not going to do a full miner with Tiny Tapeout (but you might be able to test some small parts of it with Tiny Tapeout). Start with something small and easy.","",""
"1187141985530818611","ravenslofty","2025-12-06T07:09:19.1720000+00:00","I am not entirely sure the tools could handle the power virus requirements of such an ASIC either","",""
"169786952432746498","mithro_","2025-12-06T07:13:09.9150000+00:00","That is exactly why the sky130 PDK is the way it is. Having every cell be a seperate gds file with stuff related to it in the same directory seems so logical to me. Lots of ""industry people"" hated the fact that the library was now a lot of files rather than one big file.","",""
"169786952432746498","mithro_","2025-12-06T07:19:46.9240000+00:00","The queue is currently sorted by upload time for the GDS.","",""
"1187141985530818611","ravenslofty","2025-12-06T07:21:06.0030000+00:00","I figured it was a waste of everyone's time to check my initial GDS when the requirements had changed","",""
"169786952432746498","mithro_","2025-12-06T07:21:33.3740000+00:00","I had the crazy idea that we should have a ""fill with artwork"" tool that uses things like the wafer-space logo as the fill where it fits 😛 -- Probably a terrible idea.","",""
"169786952432746498","mithro_","2025-12-06T07:24:50.2830000+00:00","There is no reason a bitcoin minor would be *required* to have a power virus like profile. You are right that most groups are optimising their designs in a way that does produces results like that.","",""
"169786952432746498","mithro_","2025-12-06T07:25:13.3340000+00:00","Well, I've finally caught up with stuff on this channel, time to check the other ones!","",""
"169786952432746498","mithro_","2025-12-06T07:29:24.0930000+00:00","","2025-12_media/image-70061.png","💜 (2)"
"169786952432746498","mithro_","2025-12-06T08:29:18.7960000+00:00","I need to take platform.wafer.space down for 30m - when it comes back up it should be able to run a lot more prechecks in parallel.","",""
"169786952432746498","mithro_","2025-12-06T08:31:09.9070000+00:00","I don't yet know when I'll do that.","",""
