AuthorID,Author,Date,Content,Attachments,Reactions
"1187141985530818611","ravenslofty","2025-12-03T14:49:29.9180000+00:00","@Tim 'mithro' Ansell do we get assigned a project ID, or is this a freeform field? it's unclear from the ""create new project"" form","",""
"323371864074485771","mole99","2025-12-03T14:50:55.0470000+00:00","You should be able to choose your own ID.","",""
"1187141985530818611","ravenslofty","2025-12-03T14:51:28.7220000+00:00","`CHES` it is then.","","🔥 (1)"
"169786952432746498","mithro_","2025-12-03T14:54:21.5990000+00:00","They have to be unique per shuttle, 4 letters/numbers and you can have [A-Z0-9]","",""
"169786952432746498","mithro_","2025-12-03T15:00:02.2710000+00:00","Well it's bed time for me.","",""
