AuthorID,Author,Date,Content,Attachments,Reactions
"384390069412429834","polyfractal","2026-01-05T17:41:31.7440000+00:00","it's all been a very elaborate scam and Tim has absconded with the money ğŸ˜›","","ğŸ˜„ (1)"
"323371864074485771","mole99","2026-01-05T17:42:09.9710000+00:00","Happy New Year, everyone!

Yes, there are updates: There were some issues with missing metal slots in some designs, mostly on the logos. The project authors have been notified and asked to review the updated layouts with the generated metal slots.
I submitted the updated reticle yesterday evening, so GF had it first thing on Monday morning.

We'll let you know as soon as we hear back from GF.","","â¤ï¸ (2)"
"732347216412278825","urish","2026-01-05T17:44:20.0800000+00:00","Assuming this goes well, how's the production timeline affected?","",""
"323371864074485771","mole99","2026-01-05T17:49:00.5440000+00:00","I'm not sure, that's for @Tim 'mithro' Ansell to say.
It depends on how the deadlines are spaced on GF's side.","",""
