AuthorID,Author,Date,Content,Attachments,Reactions
"596068704471482370","246tnt","2025-12-06T22:22:35.8880000+00:00","I hope my explanation makes sense 😅","",""
"596068704471482370","246tnt","2025-12-06T22:27:40.8440000+00:00","AFAICT from the KLayout doc for `antenna_check`, there is no way to implement the check as described in the DRM.","",""
"220639106915368960","tholin","2025-12-06T22:57:14.1700000+00:00","So is the KLayout check more or less strict than required?","",""
"378788837452677120","asc9742","2025-12-06T23:11:53.3690000+00:00","@Tim 'mithro' Ansell , the precheck gave out a error_log file but does not contain which rules were violated.
Is there a way to get the rdb file to see where the errors are?","",""
"169786952432746498","mithro_","2025-12-06T23:21:36.5730000+00:00","I'm working on that.","",""
