AuthorID,Author,Date,Content,Attachments,Reactions
"384390069412429834","polyfractal","2025-12-09T02:12:02.0250000+00:00","ah ok, makes sense. apologies for eating a slot so long!","",""
"169786952432746498","mithro_","2025-12-09T02:13:01.1230000+00:00","No apologies needed! You are actually paying for one, not like all these other free loaders ðŸ˜‰","","ðŸ˜ (1)"
"169786952432746498","mithro_","2025-12-09T02:18:03.7970000+00:00","@Leo Moser (mole99) - Which are the exactly weird / strange fill rule DRCs about active avoidance?","",""
"169786952432746498","mithro_","2025-12-09T02:25:08.5570000+00:00","I assume @Leo Moser (mole99) is probably asleep at this moment. Anyone else recall / remember which ones they were?","",""
"169786952432746498","mithro_","2025-12-09T02:36:57.8410000+00:00","I got the AI to update it's recommendation around ""cloud machines"" for EDA development with @BreakingTaps addition -> https://claude.ai/public/artifacts/44717da0-d032-4bb2-9763-87dcfbb66a8a","",""
"169786952432746498","mithro_","2025-12-09T02:41:31.5870000+00:00","I think this was it -> https://discord.com/channels/1361349522684510449/1423349035892478074/1425377835953946694","",""
