AuthorID,Author,Date,Content,Attachments,Reactions
"220639106915368960","tholin","2025-11-22T17:20:14.9770000+00:00","Is there a way for me to run the KLayout DRC checks on a GDSII file without running the full chip_top flow? I just want to know if my DACs still have DRC errors without waiting 4+ hours for DRC to run on the full chip.","",""
"596068704471482370","246tnt","2025-11-22T17:22:48.7390000+00:00","`klayout -b -zz -r ${PDK_ROOT}/gf180mcuD/libs.tech/klayout/tech/drc/gf180mcu.drc -rd input=your.gds -rd report=drc.klayout.lyrdb -rd feol=True -rd beol=True -rd dummy=True -rd offgrid=True -rd conn_drc=True -rd wedge=True -rd run_mode=deep -rd thr=16`","",""
"596068704471482370","246tnt","2025-11-22T17:23:42.8340000+00:00","That's the command run by the pre-check.","",""
"220639106915368960","tholin","2025-11-22T17:30:50.1620000+00:00","Its so annoying to me that I can spend days putting something together in magic until its DRC clean, and then KLayout comes in ""Actshually, there is 107 DRC errors""","",""
"596068704471482370","246tnt","2025-11-22T17:39:59.5460000+00:00","I think that's pretty much the deal of being on this first run is that you're beta testing stuff ...","",""
"596068704471482370","246tnt","2025-11-22T17:43:29.0120000+00:00","Although I'm looking at some of the error in KLayout and ... they might be false positive.","",""
"220639106915368960","tholin","2025-11-22T17:44:51.6530000+00:00","I have tons of DRC errors for this. So uhm. Is it too long? Too short? What is the limit?","project-template_media/image-F7AF9.png",""
"220639106915368960","tholin","2025-11-22T17:45:27.8660000+00:00","Am I about to have to dive into some source code just to know what this is about?","",""
