AuthorID,Author,Date,Content,Attachments,Reactions
"509798510170865675","essen__","2026-07-14T19:03:42.4450000+00:00","","",""
"509798510170865675","essen__","2026-07-14T19:03:43.2650000+00:00","Do you want pictures to fuel your fantasies ?","",""
"265875544552243200","vpro","2026-07-15T12:54:28.7930000+00:00","🥹","",""
"509798510170865675","essen__","2026-07-15T13:24:40.5170000+00:00","I have actually never tried there salsa, I will follow your sub-conscience's suggestion. 🫡","",""
"265875544552243200","vpro","2026-07-15T13:43:50.2490000+00:00","you totally should! they have a lot of unique flavours, worth trying them to see which one you like most","","👍 (1)"
"509798510170865675","essen__","2026-07-15T13:45:47.5010000+00:00","Any recommendations of what to start with ?","",""
"265875544552243200","vpro","2026-07-15T13:49:36.2820000+00:00","I personally really enjoyed the Chipotle Garlic they had","",""
"265875544552243200","vpro","2026-07-15T13:49:44.9930000+00:00","huge fan of smoky flavours and whatnot","",""
"265875544552243200","vpro","2026-07-15T13:50:19.2300000+00:00","if you're not a fan of canned salsa, they also have a fresh batch they make sometimes","","👍 (1)"
"509798510170865675","essen__","2026-07-15T14:13:47.2530000+00:00","Thanks, will give it a try. 🍴","",""
