AuthorID,Author,Date,Content,Attachments,Reactions
"384390069412429834","polyfractal","2025-12-04T23:45:24.8410000+00:00","thanks! took some finagling to get everything placed nicely. I knocked together a quick tool to make it easier to hand edit/place macro blocks, i'll upload it tonight when I get home in case anyone else wants to use it.","",""
"384390069412429834","polyfractal","2025-12-04T23:46:08.9260000+00:00","not entirely certain this is needed now that I discovered the 9T cells, but having everything physically close instead of columns helped get timing issues under control","",""
"169786952432746498","mithro_","2025-12-05T01:25:45.7760000+00:00","@BreakingTaps - Also this is very on topic....","",""
"169786952432746498","mithro_","2025-12-05T01:32:55.5730000+00:00","For some reason discord won't let me forward your message to #general....","",""
"169786952432746498","mithro_","2025-12-05T01:33:08.7800000+00:00","Cool!","",""
