AuthorID,Author,Date,Content,Attachments,Reactions
"758346146204090390","bunnievorpal","2026-01-21T16:09:59.2910000+00:00","this is a good question. unfortunately litex has been a moving target and i haven't been able to keep up with it on NeTV","",""
"758346146204090390","bunnievorpal","2026-01-21T16:10:33.3220000+00:00","the best bet is...i need to get back from traveling (currently not at home) and then I have to access my archive machine and dig up the virtual machine I used to build the NeTv2 firmwares","",""
"758346146204090390","bunnievorpal","2026-01-21T16:10:51.1790000+00:00","i stopped schlepping that around years ago since the project had been pretty dormant and it took like 40 gigs on my hard drive","",""
"758346146204090390","bunnievorpal","2026-01-21T16:11:40.5390000+00:00","if i can resurrect the VM it' should have a snapshot of everything as it was back then and may be able to build some things modulo the fact that i've totally forgotten how to use it and hopefully i even remember the password to log into it","",""
"758346146204090390","bunnievorpal","2026-01-21T16:13:21.9030000+00:00","might be a few days before i can try this...i'm kind of compressed until chinese new year. how urgent is it to get a 100T firmware","",""
