AuthorID,Author,Date,Content,Attachments,Reactions
"169786952432746498","mithro_","2026-02-15T23:24:34.0060000+00:00","@carlfk If you remind me on Wednesday, it should be pretty easy in theory.","","👍 (1)"
"169786952432746498","mithro_","2026-02-15T23:27:16.5490000+00:00","I""m up at Monarto setting things for my parents until late tomorrow.","",""
"443147704126668801","carlfk","2026-02-15T23:27:28.0000000+00:00","@Tim 'mithro' Ansell I need help - I think git sub-modules is the answer.","",""
"169786952432746498","mithro_","2026-02-15T23:27:52.1120000+00:00","git submodules is an answer, it is rarely a good answer despite how much we use it 😛","",""
"443147704126668801","carlfk","2026-02-15T23:28:02.9800000+00:00","to boot Kianv o tt6, I need this stuff https://github.com/CarlFK/tt-commander-app/blob/feature/cli_bl910/src/ttcontrol/cli/boot_kianv_ulinux.sh","",""
"443147704126668801","carlfk","2026-02-15T23:29:10.6650000+00:00","part of the problem is the Arty fpga thing expanded to TT, and kinda just the 1 Kianv thing","",""
"169786952432746498","mithro_","2026-02-15T23:45:10.2420000+00:00","@carlfk - My plan is that when @Matt Venn and friends finish the TT FPGA emulation board, then we will have a bunch of those in the pool.","",""
"169786952432746498","mithro_","2026-02-15T23:45:40.0450000+00:00","@carlfk - I'm not game to do the vlan rename to fix the IP address stuff while I'm remote 😛","",""
