AuthorID,Author,Date,Content,Attachments,Reactions
"443147704126668801","carlfk","2025-05-01T04:47:49.1390000+00:00","@Tim 'mithro' Ansell see die sorting robot in  https://discord.com/channels/1270929620224704544/1270933607011057776","","💯 (1)"
"169786952432746498","mithro_","2025-05-01T13:27:01.5890000+00:00","I assume this is wafer dicing? What are the lines here?","",""
"643551115920670720","digshadow","2025-05-01T17:05:51.5250000+00:00","The lines were resolution tests","",""
"643551115920670720","digshadow","2025-05-01T17:06:16.9650000+00:00","Basically trying different parameters if we made it through the wafer","",""
"756011607603019777","anfroholic","2025-05-02T03:27:07.0470000+00:00","Working on some camera type stuff","2025-05_media/image-48FCB.png",""
"756011607603019777","anfroholic","2025-05-02T04:01:59.2970000+00:00","More camera stuff","2025-05_media/2025-05-01_22-58-02-77967.mp4",""
