AuthorID,Author,Date,Content,Attachments,Reactions
"1365118310701600900","rtimothyedwards_19428","2026-07-01T00:45:36.7650000+00:00","Test of writing to the lower 4 bits of 64 words at 25MHz (also works at 50MHz but it's at the sampling limit of the USB scope).","2026-07_media/4bit_count_bench_test-45506.png",""
"1365118310701600900","rtimothyedwards_19428","2026-07-01T00:52:18.8220000+00:00","Test setup with one Digilent Analog Discovery 2.","2026-07_media/sram_test_2a-E7B04.jpg","💜 (4)"
"262706220073222144","namibj","2026-07-01T15:05:57.0520000+00:00","Can we get some amount of reporting as to how good as a PUF that SRAM behaves?
Like, reading the power-on bit pattern of a few dies and seeing how stable and unique it is per-die?

If it's at least not-terrible, I could try next week about getting a probably-smallest-tested SRAM macro set up, if I can think of a way to read it _at all_ without an electrical pad contact to the die.","",""
"1365118310701600900","rtimothyedwards_19428","2026-07-01T15:26:01.6010000+00:00","@namibj :  I don't have any kind of temperature force unit, so I won't be able to determine if the power-up pattern is stable over temperature.  I would tend to expect it to be dependent on the 3.3V supply ramp, as well.","",""
