AuthorID,Author,Date,Content,Attachments,Reactions
"323371864074485771","mole99","2025-09-30T12:11:54.3040000+00:00","","",""
"323371864074485771","mole99","2025-09-30T12:11:54.9700000+00:00","For the analog layout, do you want to use magic or KLayout?

gf180mcu has PCells for both. However, the KLayout PCells require a more complex setup due to the use of GDSFactory.","",""
"1214459146217201704","vks_007","2025-09-30T12:17:41.5780000+00:00","I will prefer magic as have worked on it earlier for few designs but open for klayout also.","",""
"1214459146217201704","vks_007","2025-09-30T12:18:10.6660000+00:00","What about schematic, simulation, lvs steps? Is it similar to as for sky130?","",""
"1214459146217201704","vks_007","2025-09-30T12:18:25.9630000+00:00","Using xschem, ngspice , netgen","",""
"323371864074485771","mole99","2025-09-30T12:32:14.3200000+00:00","Yes, it's pretty much the same. I would recommend installing the latest PDK via ciel (https://github.com/fossi-foundation/ciel) and taking a look at the tool-specific setup in gf180mcuD/libs.tech/*.

You can then ask any specific questions here.","",""
