AuthorID,Author,Date,Content,Attachments,Reactions
"756011607603019777","anfroholic","2026-06-02T03:57:00.9190000+00:00","@RebelMike the 1xp5 boards have arrived. Pretty sure some will be bonded shortly. 
@Tim Edwards I think yours and @Greg will also be bonded in this run.","2026-06_media/76725dd706011a5e8b5f7b526c66f59e-BDDB9.jpg","🔥 (1),🎉 (2)"
"675149742183022602","chasees18","2026-06-02T13:10:45.6650000+00:00","Hi Andrew @Andrew Wingate and Tim @Tim 'mithro' Ansell , I have heard from Tim that there is a good method verifying the wire bond connections. Would you mind helping pointing me to the correct location where this verification method is discussed. This would help a lot in our chip debugging. Many thanks.","",""
"691780627338625077","rebelmike","2026-06-02T13:56:00.6320000+00:00","Was the ground fill on the region between the die and the pins intentional?  I think that was blocked originally.  And there was some discussion of putting soldermask in that region so the vias were covered, is that still something that we think we should try?","",""
"262706220073222144","namibj","2026-06-02T14:15:04.2870000+00:00","Oh as I see this now if they're done by JLCPCB, I'd propose using their serialization service that'll give per-individual silkscreen serials in plain text (+ (QR/datamatrix)), though for proper traceability beyond the bondhouse the die sorter would probably have to place the dies directly onto the COB and electronically record what specific die got placed onto that serial number COB?","",""
"262706220073222144","namibj","2026-06-02T14:16:08.8260000+00:00","Iirc we'd need those vias covered at the top or fully open to prevent air bubbles inside from going up through the encapsulation.","",""
"262706220073222144","namibj","2026-06-02T14:17:04.3150000+00:00","ESD diode of the pad can be easily checked for presence once you have a working GND and a working VDD pad.","",""
"262706220073222144","namibj","2026-06-02T14:18:00.1720000+00:00","Iirc you just carefully diode test with pad voltage below GND to see the diode to GND, and above VDD to see the diode to VDD.","",""
"675149742183022602","chasees18","2026-06-02T16:54:16.1180000+00:00","Thanks for the suggestion it’s good idea to check the bonding by testing the ESD diode. I am not sure the method mentioned by Tim is same as this, or there are other method verifying it (physically or electrically)","",""
"262706220073222144","namibj","2026-06-02T17:09:30.6430000+00:00","AFAIK the esd diode was the suggested check of bonding, shy of any testability instrumentation in the chip itself.","","👍 (1)"
