AuthorID,Author,Date,Content,Attachments,Reactions
"323371864074485771","mole99","2026-04-16T15:07:50.1470000+00:00","","",""
"323371864074485771","mole99","2026-04-16T15:07:50.9500000+00:00","Good idea! The problem is actually not the generate loops (those are disabled at 0), but the top-level ports: `inout  wire [NUM_ANALOG_PADS-1:0] analog_PAD` becomes `inout  wire [-1:0] analog_PAD`. 
Please open an issue on the repo so I remember to add an `ifdef`, or feel free to create a PR.","",""
"1447738536638943333","dorythecat_v2","2026-04-16T15:08:28.9870000+00:00","alr! I'll do when I have a bit of time! Thx for the quick response! <3","",""
"323371864074485771","mole99","2026-04-16T15:11:51.8490000+00:00","Great, thanks!","",""
