AuthorID,Author,Date,Content,Attachments,Reactions
"262706220073222144","namibj","2026-07-01T14:30:33.3680000+00:00","","",""
"262706220073222144","namibj","2026-07-01T14:59:35.5520000+00:00","@BreakingTaps perhaps you'd come up with info on the matter of photovoltaic mode operation of cells; particularly on the subject of whether multiple photodiodes in photovoltaic mode can be series connected to produce sufficient voltage for CMOS logic; I'd have ideas based on native nmos that wouldn't require more than the 500~700mV to operate but they're all unfortunately large structures due to the unavailability of any pmos devices with threshold voltages ""reasonably below"" diode forward voltage.

I'd guess there are some available (on gf180mcuD) tactics for bootstrapping a charge pump voltage booster from a singular solar cell?

Maybe substrate-tied dnwell with an lvpwell-to-dnwell photodiode (producing positive voltage relative to substrate) acting in series with a separate (d)nwell-to-psub diode (producing negative voltage relative to substrate) could work.
The negative bias could allow biasing pmos devices to act as resistors for native-nmos devices doing the actual logic, which would massively shrink the area requirements for the logic and probably also comfortably stabilize operating reliability against process variations in native nmos threshold voltage.

No good idea yet about back channel though; forward channel is obvious through just sufficiently deep amplitude modulation of the light, some probably-MIM storage caps for logic voltage supply, and some dynamic logic kind of data demodulator.
Or if there's two beams available obviously just either differential signaling with some kind of clock recovery or a synchronous clock-and-data interface.

My goal is btw. to get a PUF-like structure that can be read out at the die sorter without needing to touch the bond/probe pads during this, to later post-packaging read the same PUF-like from digital logic, being able to match against the database the die sorter created, getting to look up what coordinates on which wafer that die came from. Or realistically just what reticle on which wafer (it's far cheaper to just encode the intra-reticle location with a few bits of mask ROM structure).

I'm aiming towards enabling full traceability that way; if one wants easier IDs one can just put efuse PROM onto the die and burn these coordinates and other tracing information during the first post-packaging e-test of the die, just as part of the test pattern interaction; might require some scripting there but shouldn't be too involved for a vaguely flexible tester platform.","",""
"262706220073222144","namibj","2026-07-01T15:06:33.1040000+00:00","Oh, NFC-style with on-die inductor comes to the mind as well, just now!","",""
"262706220073222144","namibj","2026-07-01T15:06:41.0680000+00:00","@Tim 'mithro' Ansell","",""
"384390069412429834","polyfractal","2026-07-01T15:57:02.1980000+00:00","hmm, I do recall reading a paper some years ago about an image sensor that was self-powered. I forget the scheme exactly but it basically toggled between energy harvesting and image capture. so in principle it's probably doable.  will see if I can find the paper...","",""
"262706220073222144","namibj","2026-07-01T18:24:09.3940000+00:00","Hmmm; the NFC idea that came right after I sent that wall-of-text (it's technically the immediately following message in this channel) does feel somewhat more applicable right now at least; if using top metal for the resonant inductor of it and de-tuning by switching a cap into/out of the tank or even just modulating the load it puts onto the tank via some kind of like shunt/series combo LDO regulator, or literally shorting out the tank (with sufficiently limited duty cycle ofc.):
some way probably has enough intensity in the back channel to make it not require high specs from the reader.
After all, for reasons of getting by with a compact coil and not having the global PDN ring enclosing the ""regular user area"" of the die wreck the Q of the resonant tank, I'd expect this to effectively-need a near-field H-field antenna. probably set up to sweep the frequency band of interest until it hits evidence of exciting the receiver's resonance (process variations cause some shift in resonant frequency), perhaps in a shape of a narrow gap between two coils thick enough for the die to slide into and deep enough to reach in just past the pad&PDN ring, or even just a more-pointy-tip ""loop antenna""/H-field-oscilloscope-probe roughly visually aligned to and pointed close to but not touching the die by where that die has it's NFC-antenna.

Light clearly has the benefit of less risk of accidentally scratching the die and not worrying about EMC compliant operation of the reader, but I'd assume a back channel to be FAR more difficult to pull off than just using simple well-trodden NFC tech.

[||If I knew of a low-cost source for single-emitter variants of the triple-emitter https://ams-osram.com/products/lasers/ir-lasers-vcsel/osram-bidos-e1005-l-plpvyl1-940a-e , I'd be far more hopeful in possibly making optically powered bootstrapping (coupled through a simple multimode fiber) a silicon-proven thing on not-my-dime (well, as far as the tapeout masks for the process of silicon-proving the bootstrap mechanic goes)....

...as that should be readily usable for bootstrapping any design variants of the switched-capacitor based MVDC-tamer plans (which I have _not_ given up on bringing towards a hands-on PoC demonstrator). Like, charging the local LV supply capacitors through optically provided power while the higher-voltage supply is not yet connected, as they later harvest from the resonant EM fields once in operation, and it's not necessarily easy to inject such ""RF"" power and not even necessarily feasible to bootstrap off of that due to the harvesting architecture that's preferred for steady-state possibly requiring synchronous rectification or switching of the power transistor.

E.g. one could have a rectification diode from the harvesting node into the local storage capacitor, a capacitor from that node to the high-voltage drain node of the power switch, and a low-loss clamp shunt transistor that can ground the harvest node to the power transistor's source which also acts as the local ground.

...errr, the last bit of thinking I allotted to the matter this week just revealed that if the power switch has automatic reverse diode behavior for the drain node, it would probably be safe to use this particular harvesting architecture as the voltage amplitude during bootstrap procedure is limited by the drain to-source capacitance (including the harvesting capacitor's contribution) and the bootstrap current amplitude, while the power drain-source leakage even if little prevents the drain voltage from building up much beyond the previously given implied peak-peak voltage amplitude, as long as it exceeds bleed-to-environment enough, and reverse voltage is clamped by the drain-source diode of the power switch....
||]","",""
"692781607102185522","rrichmondr","2026-07-01T18:59:55.7810000+00:00","Hi everyone, is ti possible to change the IO configuration on the chip ? for example the full tie list 56 (bidir: 40, in: 14, analog: 2), could we add more analogs ? and still get the chip on board packagin ?","",""
"756011607603019777","anfroholic","2026-07-01T19:05:26.6000000+00:00","Yes @RRichmondR you are able to change any of the io pads to whatever you wish. With the cob the ground nets will be shorted and the power traces (currently) have decoupling caps.","",""
"692781607102185522","rrichmondr","2026-07-01T19:17:29.5170000+00:00","and is there any information regarding the max io speed  on the digital ones ? i couldn't find anything","",""
"691780627338625077","rebelmike","2026-07-01T20:00:36.0810000+00:00","Sample size of 1, but on the Tiny Tapeout board I could clock the factory test design at up to 188MHz and it would work correctly.  On the output side I don't have a good enough scope but the drivers are pretty strong - they still seemed pretty good at 100MHz","","👍 (2)"
"596068704471482370","246tnt","2026-07-01T20:10:43.6310000+00:00","They're actually a bit too strong ... so if you wiring isn't up to par you get quite a bit of ringing due to the fast edge, so much I actually got some double clocks on spi lines in some conditions.","",""
"262706220073222144","namibj","2026-07-03T00:26:56.9440000+00:00","what happened if you went a little beyond that speed? Minor amount of swalloed clocks? Minor excess count? Sudden breakage? No faster quality clock source on hand to try to feed in and see if it can go faster?","",""
"691780627338625077","rebelmike","2026-07-03T07:38:06.3330000+00:00","Seems like sudden breakage, when I’ve run this test before on sky chips it’s normally shown one missing count, then two before breaking down. But here it suddenly starts missing lots of clocks. Unfortunately two variables have changed at once though because TT has moved to a new demo board with mezzanine connectors so I can’t test in my old setup, and the demo board has a possibly non-ideal debounce circuit for the manual clock button hanging off the clock line.
Update though, I tried a higher drive strength from the RP2350 that’s generating the clock and got up to 220MHz ok (again sudden breakage at 224MHz)","","ferrisCatOwO (1)"
"596068704471482370","246tnt","2026-07-06T15:12:37.0470000+00:00","Started a thread.","",""
"290925586266980352","osvel","2026-07-08T14:51:54.9590000+00:00","What's your preferred workflow for analog / mixed circuits? I'm currently trying out xschem + ngspice, but have a hard time to load the gf180mcuC pdk lib properly.","",""
"738396032295108721","bailey8889","2026-07-08T21:59:29.7760000+00:00","@Leo Moser (mole99) is wafer.space using gf180mcuC as opposed to gf180mcuD?","",""
"290925586266980352","osvel","2026-07-08T22:02:30.3080000+00:00","Sorry, typo by me! 🙂","",""
"323371864074485771","mole99","2026-07-08T22:19:58.5570000+00:00","Nope, gf180mcuD :)","",""
"262706220073222144","namibj","2026-07-12T15:33:31.8190000+00:00","Ok let's dig into the https://www.tinytapeout.com/news/mini-mosbius/ design files and find out if it can be almost-copy-pasted to gf18mcuD with just a bit of scaling to fit the AFAIK substantially less compact standard cell logic that I'm assuming to make up a large part of the configuration bitstream handling.","",""
"692781607102185522","rrichmondr","2026-07-12T21:07:55.3930000+00:00","i have generated the padframe for our mix signal design.
my undesrtanding is that ill place on that gds our analog cells and then upload that gds to the platform am i right or am i missing something ?","",""
"262706220073222144","namibj","2026-07-12T23:45:23.2270000+00:00","Pretty much?
That's one way at least.","","💖 (1)"
"262706220073222144","namibj","2026-07-12T23:46:01.4590000+00:00","There is a point where you need to connect your digital and your analog though.","",""
"692781607102185522","rrichmondr","2026-07-13T17:20:37.2010000+00:00","the connection would i have to do it mannually right ? (i ran the drc on klayout and got errors on the IOs of the padframe not the design itself)
one friend is thinking about putting the analog cells as macros and let openroad do the routing","",""
"262706220073222144","namibj","2026-07-13T19:36:55.0060000+00:00","You can pre-route any critical analog connections in the flow with openroad picking up the reminder; @Tholin 's submissions AFAIK rely on the auto-route approach; not sure to what extent they've pre-routed any of the nets though.","",""
"220639106915368960","tholin","2026-07-13T19:38:47.1390000+00:00","I didn’t know you could do this","",""
"262706220073222144","namibj","2026-07-13T19:40:31.0960000+00:00","It's like a power wire just less griddy","",""
"290925586266980352","osvel","2026-07-13T22:11:25.4930000+00:00","https://gf180mcu-pdk.readthedocs.io/en/latest/analog/model_parameters/LV/LV_9.html

Is this not part of the public release or is it just undocumented?","",""
"290925586266980352","osvel","2026-07-13T22:25:15.4670000+00:00","And one other question... People doing analog designs, are you using deep N-wells / guard rings? Are they really important? 🙂

I saw there was a klayout plugin for sg13g2 (https://github.com/mwolodzk/klayout-sg13g2-tap-guard-ring-plugin) for making these automatically around a selection (for instance when using matched pairs). Thought myself about copying this but using the rules from gf180_fd_pr","",""
"262706220073222144","namibj","2026-07-13T22:47:42.4260000+00:00","Latter.","",""
"262706220073222144","namibj","2026-07-13T22:51:13.9550000+00:00","If you don't know better, go for them; our PEX flow(s) AFAIK still completely lack support for modeling substrate currents, so we can't ""just"" ""simulate and see"" if it behaves without the dnwell.","",""
"290925586266980352","osvel","2026-07-14T05:19:35.0350000+00:00","Good tip, thanks! 🙂 I guess I will use them then. :^)","",""
"290925586266980352","osvel","2026-07-14T11:07:08.3560000+00:00","Oh wait, are all 3.3v PCells totally broken? I have tried both in magic and klayout, both seem to produce illegal nfets (w = 0.36u l = 0.28u, nf=1), mostly regarding grid alignment. For example, the gate metal seems to be misaligned in klayout, but too small in magic.","",""
"290925586266980352","osvel","2026-07-14T11:08:09.7320000+00:00","Is no-one doing analog stuff using the builtin FETs from gf180_fd_pr?","",""
"596068704471482370","246tnt","2026-07-14T11:19:01.6750000+00:00","The metal in magic is too small area that's expected. That's because it's where you should be connecting your stuff to ... so area will get bigger when you actually wire it to something.","","👍 (1)"
"290925586266980352","osvel","2026-07-14T11:19:57.2400000+00:00","ok so its maybe just klayout then that is broken. It doesn't seem to properly align to the grid, which is a problem :^) Will try out magic for a while","",""
"290925586266980352","osvel","2026-07-14T11:21:51.9050000+00:00","I must say the grid/pixel based system feels nicer than the object based one in klayout","",""
"596068704471482370","246tnt","2026-07-14T11:27:24.0680000+00:00","Yeah, personally I prefer magic for layout too.  Other prefer KLayout, there is definitely some amount of subjective preference in there, you can make successfull layout in both and there will be things that work well and things that are a bit stickier with both.","",""
"290925586266980352","osvel","2026-07-14T11:46:34.1330000+00:00","hm.. `Metal1 spacing < 0.23um (M1.2a)`

This is before drawing anything.","2026-07_media/image-2D1D6.png",""
"290925586266980352","osvel","2026-07-14T11:48:19.2590000+00:00","Sorry, I'm a bit of a noob :^) I guess I can go into it and quickly fix it up?","",""
"492702620759228416","mattvenn","2026-07-15T12:19:18.4230000+00:00","It's because it wants metal on top, without metal over the via you get this DRC","",""
"325334453213986816","were491.","2026-07-15T13:30:06.5680000+00:00","o yea this wasn't an issue with dbu=0.005u so theoretically you can just design with that and then flatten everything before changing dbu back to 0.001u and then it won't be misaligned","",""
"262706220073222144","namibj","2026-07-15T15:04:14.6650000+00:00","Yeah I do question the sense of a dbu smaller than a mandatory minimum quantization/snapping grid.","",""
"325334453213986816","were491.","2026-07-15T15:06:47.8120000+00:00","gf180 pdk said to use 0.005 dbu but waferspace wants 0.001 for some reason","",""
"323371864074485771","mole99","2026-07-15T15:10:56.5090000+00:00","The dbu for gf180mcu is 0.001, the manufacturing grid is 0.005.","",""
"290925586266980352","osvel","2026-07-15T15:12:11.7890000+00:00","Good tip, will keep in mind! I decided to abandon klayout (for better or for worse) and just later import my design to do their DRC.","",""
"290925586266980352","osvel","2026-07-15T15:15:13.2950000+00:00","I figured out the issue in magic also. Seems like picking a too small L causes this. Should probably report it but its a design constraint so don't really know how the pcell generator should work tbh","",""
"262706220073222144","namibj","2026-07-15T15:19:01.5350000+00:00","Yeah; can you justify that choice beyond ""it was picked many years ago and _nice round number_ and changing now would break too much""?","",""
"596068704471482370","246tnt","2026-07-15T15:23:57.3970000+00:00","The latter is quite a big concern 😅 
For instance, I know in TT because we copy the stream directly when including macro to make sure we don't alter them, they need to all have the same unit or they end up at different scales ...","",""
"262706220073222144","namibj","2026-07-15T16:48:29.6080000+00:00","Tbf, scaling all coordinates by an exact integer factor while verifying no quantization errors happen is pretty tame risk-wise; but yeah. 

I'm mostly just confused as to who thought this current state would have any decency in UX, vs. the dbu enforcing the manufacturing grid to make it literally impossible to trip the OFFGRID DRC (at least on PDKs that don't have layer-dependent manufacturing grids; I think sky130 might have a coarser grid for m3/m4/m5 than for li/poly/comp).","",""
"325334453213986816","were491.","2026-07-15T21:15:10.8090000+00:00","i feel like the issue is forgetting to scale at some place lol","",""
"325334453213986816","were491.","2026-07-15T21:15:58.4110000+00:00","also, usually you should set a grid size in klayout anyways right? in this case it's just a pcell bug that could be fixed","",""
"325334453213986816","were491.","2026-07-15T21:16:20.8790000+00:00","~~maybe i'm larping too hard though~~","",""
"262706220073222144","namibj","2026-07-15T23:39:34.2430000+00:00","If only that was something hard-enforced, and not a mouse cursor tool courtesy...","",""
"290925586266980352","osvel","2026-07-16T20:40:29.0740000+00:00","I am sure the PDK  has more of these issues. A random idea would be to add regression tests to the pcell library (afaik klayout pcells are written in python) and ensure that the vertices all land on grid","",""
"290925586266980352","osvel","2026-07-16T20:40:59.2640000+00:00","Could even fuzz the parameters to find edge cases","",""
"290925586266980352","osvel","2026-07-16T20:42:03.0960000+00:00","(maybe just do this with AI and file some reports)","",""
