AuthorID,Author,Date,Content,Attachments,Reactions
"1365118310701600900","rtimothyedwards_19428","2026-05-26T21:41:53.0280000+00:00","@namibj :
(1)  No worries;  I am working through the problems and was just letting you know the status.

(2) Yes, assuming that the NAT layer is included in the process options (which I think is true for Wafer.Space), then both 3.3V and 5/6V native nMOS devices exist.  That's according to the documentation:  ""This process supports 3.3V and 5V/6V native Vt NMOS. The difference between 3.3V and 5V/6V native Vt transistor is that the 5V/6V native Vt NMOS need Dualgate layer.""  The real problem here is that there is no _device model_ for the 3.3V native Vt nFET.  Given some test structures and somebody with a wafer probe station and the proper instrumentation, we could presumably generate a reasonable device model.","",""
"262706220073222144","namibj","2026-05-26T22:17:59.5830000+00:00","As we have models for the other siblings and those models are claimed to be physical models, would it be reasonable to interpolate into the `nfet_03v3_nvt` and hit approximately as (in-)accurately as the regular process corners (ff/fs/sf/ss) already are?
I'd try to make it for this tt experimental shuttle at least to get the MCML VCO + NRZ serialiser completed drawn, and I'd quite like to use them in the upper level of the D-latch DIV2; bias current is externally supplied anyways and should cover a lot of potential variation, it's only really the strength of the memory pair vs. the input pair that really matters due to the tail current source so yeah...

Honestly I am severely surprised they just left it out? Completely?
I'd think we should at least get some etest data, that has to exist, right?","",""
"262706220073222144","namibj","2026-05-26T23:36:58.4680000+00:00","I haven't tested them _yet_ but that'll not be too long.
Even if they don't model/simulate, they will have to extract even just for LVS to be possible; I believe the current state of silent swallowing /ignoring is the worst option; extracting a model that clashes for lack of spice library coverage should still be better than silently ignoring what to our understanding will become a non-negligible transistor.

Oh, and just for completeness's sake, the gds I drew real quick in klayout with the `nfet_03v3_nvt` device structure that doesn't extract.","2026-05_media/nfet_03_v_3_nvt_bins_6_10-42483.spice,2026-05_media/nmos_03v3_nvt_test_flattened_01-95E66.gds",""
"262706220073222144","namibj","2026-05-26T23:38:52.6500000+00:00","(Oh, yeah, disclaimer almost forgotten; that spice there was LLM'd out of the `nfet_06v0_nvt` and the `nfet_03v3`models.)","",""
"1365118310701600900","rtimothyedwards_19428","2026-05-26T23:40:14.7730000+00:00","I can add a device model extraction to the tech file for magic.","",""
"262706220073222144","namibj","2026-05-26T23:40:38.1320000+00:00","Thanks. NO rush I won't get to use it before middle next week at the earliest.","",""
"262706220073222144","namibj","2026-05-26T23:42:40.7630000+00:00","If you dare look at the LLM-written .spice, I wouldn't hate an opinion on the uncertainty treatment/coding done in there; that was not the LLM's idea to be clear, that was my thought.","",""
"262706220073222144","namibj","2026-05-26T23:43:29.9600000+00:00","well, not get to use it  for anything productive, at least. I might be able to run it sooner 😄","",""
"1365118310701600900","rtimothyedwards_19428","2026-05-26T23:43:59.1050000+00:00","@Tim 'mithro' Ansell :  Any chance of getting hold of a model for what should be `nfet_03v3_nvt`?  It did not exist in the original GF PDK.  It probably exists in other GF180 processes, where the model might even be similar enough to use as a placeholder until we can characterize the device ourselves.  Getting GF to open source that model is a separate question, though.","",""
"262706220073222144","namibj","2026-05-26T23:47:09.2190000+00:00","honestly some etest data ideally on a setup that also has `nfet_03v3` and `nfet_06v0` and `nfet_06v0_nvt` under presumed-same process corner and with sufficiently similar probing parasitics should allow narrowing in these uncertainties of the fairly-naive extrapolation into this missing model ""corner""; it'd probably be functional after that.
We already have all the sibling models in the PDK, after all; I don't see what beyond etest qualification ground-truth is missing to properly fit that model corner....","",""
"1365118310701600900","rtimothyedwards_19428","2026-05-26T23:50:30.2880000+00:00","@namibj :  The SPICE model for `nfet_03v3_nvt` should not have parameters `s_sab` and `d_sab`.  Those parameters exist only for the ""drain-side (un)salicided"" devices which have the suffix `_dss`.  The `dss` devices are very different and the `nvt` device should not be derived from them.","",""
"262706220073222144","namibj","2026-05-26T23:50:36.6080000+00:00","(If I'm wrong please do tell. And I don't particularly see why they would have good reason to hide a dump of etest for the 4 symmetric nfet devices on gf180mcuD; unless they don't casually collect such data or the way they collect it involves too-secret transistor geometry choices.)","",""
"262706220073222144","namibj","2026-05-26T23:51:06.7550000+00:00","Oh thank you I will get that taken care of.","",""
"262706220073222144","namibj","2026-05-26T23:51:46.0230000+00:00","(But the general concept of the uncertainty modeling is not-bad, or?)","",""
"1365118310701600900","rtimothyedwards_19428","2026-05-26T23:54:33.9170000+00:00","No idea, really.  I have to stare at the models for a lot longer.","",""
"262706220073222144","namibj","2026-05-26T23:54:47.6700000+00:00","oh.","",""
"262706220073222144","namibj","2026-05-27T00:00:13.5550000+00:00","Basically the idea was to instead of the normal mostly-2-dimensional ""process corner"" scheme (very separate from local missmatch) to add a bunch more dimensions to cover the independent knobs of the BSIM model that had to be mostly-guessed/extrapolated from the 3 other `nfet` variants, with the goal being that if one can at least give decent estimations for the range of values that would be plausible/realistic to have there given the other nfet models, then the monte carlo tactic would allow testing if across the ranges of realistic parameter values, the circuit in question would nonetheless stay functional (even if perhaps somewhat derated from the plans), which would allow using it quite liberally in the ttgf0p3 analog test die that goes in Run2.","",""
"169786952432746498","mithro_","2026-05-27T00:02:13.7010000+00:00","Any idea why it didn't exist in the original GF PDK?","",""
"1365118310701600900","rtimothyedwards_19428","2026-05-27T00:02:38.8820000+00:00","No clue at all.","",""
"262706220073222144","namibj","2026-05-27T00:05:07.9520000+00:00","even `nfet_06v0_nvt` is only a singular bin..... also doesn't appear to have any missmatch modeling done to it.","",""
"262706220073222144","namibj","2026-05-27T00:06:30.8350000+00:00","(I'm low key surprised you're still paying for the `NAT` mask layer on the upcoming runs, but I guess it's easier than modifying the PDK tooling to get rid of it and change what exdact process is run at glofo.)","",""
"169786952432746498","mithro_","2026-05-27T00:07:41.2390000+00:00","From https://bit.ly/gf180mcu-names - I'm guessing it would be called something like nmos_3p3_nat in the original PDK.

It does seem like it appears in the ULL and IC PDKs","",""
"262706220073222144","namibj","2026-05-27T00:09:29.2630000+00:00","Who with their ""normal"" mind wants ""-0.32/-0.12/0.08 V (min/typ/max)"" threshold voltage (`W/L= 10/1.8`; `VT0 (@Vds=0.1V,Vgs at Ids maximum Slope, Vt0=Vgs_intercept-0.5*Vds)`) after all....","",""
"262706220073222144","namibj","2026-05-27T00:12:38.5890000+00:00","only good for cascodes and _I think_ speed-pushed MCML buffers. If one happens to have a negative supply they can also be used as high-side power gating n-channel switches, but turning them off seems to need a negative gate bias of around 500~1000 mV.","",""
"169786952432746498","mithro_","2026-05-27T00:12:44.3100000+00:00","The details about mask layers that I have is at https://docs.google.com/spreadsheets/d/1RRPZ5prd2J3x1TO8l8eW8O50F2o9tF4JRuRT-NS01oU/edit?gid=2033140516#gid=2033140516 and https://docs.google.com/document/d/1Uf6xGZHpuA_G4iyAvxDwEENMjPBAf0Q16D0c8F0lbDQ/edit?tab=t.0","",""
"262706220073222144","namibj","2026-05-27T00:19:27.5740000+00:00","ahhh ok so is this mask 1L: `MVNVT`.... sadly https://gf180mcu-pdk.readthedocs.io/en/latest/physical_verification/design_manual/drm_04_2.html smells like NDA wall to me","",""
"596068704471482370","246tnt","2026-05-27T05:59:38.2430000+00:00","AFAIK/U ""native"" device don't really need another mask. You need a mask to know where to put Vt implants but you need that mask anyway for normal transistors. The `NAT` GDS layer just tells the mask generation to not put implants on that transistor ...","",""
"262706220073222144","namibj","2026-05-27T08:33:51.8430000+00:00","They say the devices are optional that implies to me they're not truly free at just not under all cheapenings of the process.","",""
"262706220073222144","namibj","2026-05-27T08:36:53.1380000+00:00","And if native devices were free why do only thick oxide native devices exist on sky130A?
They use the same GDS drawing layer as the low (but still very non-zero) threshold voltage `nfet_1v8_lvt`.","",""
"1365118310701600900","rtimothyedwards_19428","2026-05-27T12:15:57.1470000+00:00","@namibj :  I have used native Vt devices pretty much exclusively for cascodes.  The `05v0_nvt` device in sky130 works quite well as a cascode on top of a normal 3.3V nFET, and the gates of both devices can be driven with the same voltage, avoiding the need to set up a cascode voltage on the n side.","",""
"262706220073222144","namibj","2026-05-27T12:17:17.1540000+00:00","I'm looking to use them in especially upper tiers of an MCML pull-down-network.","",""
