AuthorID,Author,Date,Content,Attachments,Reactions
"1365118310701600900","rtimothyedwards_19428","2026-05-20T23:21:59.0940000+00:00","Oh, if you want the sources right away, just get them from my server at opencircuitdesign.com.  I use github as a mirror and do an automatic copy every night by cron job.","",""
"262706220073222144","namibj","2026-05-20T23:22:18.3470000+00:00","Ohhh ok.","",""
"1365118310701600900","rtimothyedwards_19428","2026-05-20T23:22:38.5260000+00:00","(`git clone git://opencircuitdesign.com/magic`)","",""
"262706220073222144","namibj","2026-05-20T23:26:53.1040000+00:00","> STATUS: Partly done (early 2020). Extresist now handles all device types, but there is a very strong need to remove the dependence on reading the "".sim"" format and just work all calculations from the values in the "".ext"" file. For example, extresist cannot now handle the substrate node because the "".sim"" format has no concept of a substrate.
oh, would this enable bulk substrate current flow treatment for PEX? At least, in theory; considering that the substrate being substantially thicker than most features would invalidate the simplified sheet resistance 2D-only treatment done so far on BEOL PEX?","",""
"262706220073222144","namibj","2026-05-20T23:34:21.7630000+00:00","ok running that then; compiling.","",""
"1365118310701600900","rtimothyedwards_19428","2026-05-20T23:52:56.9510000+00:00","Actually I resolved the issue with the substrate before I removed the dependency on the .sim format.  The main thing that removing the .sim dependency did was that it allowed me to start working on hierarchical R-C extraction, which I have partly completed work on (but haven't pushed yet;  still just a local branch on my desktop).","",""
"262706220073222144","namibj","2026-05-20T23:53:24.0140000+00:00","Did the sim dependency get removed some time since december?","",""
"1365118310701600900","rtimothyedwards_19428","2026-05-20T23:54:00.8110000+00:00","Yes.  Most of that work was done in January, I think.","",""
"262706220073222144","namibj","2026-05-20T23:55:13.2300000+00:00","This hierarchical R-C extraction you speak off, how does that handle the layer-penetrating capacitive coupling in, let's say, a standard cell fully-synthethic floorplan (a plain hard macro synthesized from Verilog into a prescribed rectangle; let's presume it goes all the way to top metal)?","",""
"262706220073222144","namibj","2026-05-20T23:55:40.8320000+00:00","Like, between the cells themselves and the sea of cells.","",""
"262706220073222144","namibj","2026-05-20T23:56:23.4310000+00:00","Yeah I noticed the files that got produced changed since I moved from the old nix-provided magic version in these PEX trials here.
Edit: and just was a little curious now that I read about sim file dependency getting removed.","",""
"1365118310701600900","rtimothyedwards_19428","2026-05-20T23:58:38.5380000+00:00","The parasitic capacitance is already taken care of, hierarchically.  The problem is distributing the parasitics correctly to each sub-network where a net has been broken down into resistive components.  The other problem with hierarchy is determining for each connection between parent and child, which subnets that connection is between.","",""
"1365118310701600900","rtimothyedwards_19428","2026-05-21T00:01:15.3450000+00:00","The capacitance calculations are quite complicated, looking at the child cell in isolation, the parent cell in isolation, then the parent cell with each child cell added in turn, being careful to find where parasitics in isolation get modified by the presence of all the child cells.","",""
"262706220073222144","namibj","2026-05-21T00:41:28.9010000+00:00","Yeah, to me that has seemed overall somewhat wasteful?
Like, I don't _really_ get how that will benefit simulation.
At least Xyce appears to just flatten at parse time anyways, where this may at most have vestigial effects on how the circuity is distributed across parallel compute nodes if doing some netlist-ordering-based distribution tactic.

To me it seems like it should probably be usually cheaper computationally to just extract the PEX flattened, or at least the coupling part (resistance could probably be extracted locally with little harm, but would probably have to treat each contact spot of the ports independent to use the correct node to tie the higher level resistance to the intra-cell resistance).
That said, the capacitance extraction should be pretty straight-forward to do in parallel, just tile the overall area into twice as many strips as one wants to run in parallel, keeping a minimum strip width large enough to completely absorb the sideways fringing modeled reach, then process all even strips first in parallel, then add all odd strips in a second parallel run.","",""
"1365118310701600900","rtimothyedwards_19428","2026-05-21T00:47:37.3460000+00:00","It doesn't benefit simulation.  It benefits extraction, which is quicker, and produces much smaller files.","",""
"1365118310701600900","rtimothyedwards_19428","2026-05-21T00:50:13.5310000+00:00","Also:  Since magic's `.ext` file output is an intermediate form, and all the hard work is done to get to the intermediate form (`ext2spice` is quick and easy), then the hierarchical format also has the benefit that from the intermediate `.ext` form, you can quickly get any netlist for any cell in the design, with or without parasitics, without having to go through the extraction process again.","",""
"262706220073222144","namibj","2026-05-21T00:51:42.8250000+00:00","Hmmmm....","",""
"262706220073222144","namibj","2026-05-21T00:55:17.9320000+00:00","","2026-05_media/flamegraph_1-91661.png",""
"262706220073222144","namibj","2026-05-21T00:58:06.0790000+00:00","seems to be from this region; it was stacktraces that got chopped off for being too deep.","2026-05_media/image-4067E.png",""
"1365118310701600900","rtimothyedwards_19428","2026-05-21T01:00:33.5880000+00:00","Except that all that is from basic extraction;  that's been worked over quite a bit and I consider it to be reasonably efficient.  For example, on my desktop, the extraction of your full chip design took 1 1/2 hours.  Right now, the vast majority of the compute time is not in the basic extraction but in the resistance extraction, which happens afterward.","",""
"262706220073222144","namibj","2026-05-21T01:06:57.6170000+00:00","Ahhh yeah it's getting there.","",""
"262706220073222144","namibj","2026-05-21T01:07:55.9940000+00:00","(That was more a questioning of how wise of a decisiion it is to do that stepping recursively; it feels like it might hit stack exhaustion on some layouts due to that.)","",""
"1365118310701600900","rtimothyedwards_19428","2026-05-21T01:09:48.7150000+00:00","I have gotten rid of most of the methods in magic that were apt to hit recursion limits.  I know the extraction ""walk"" routines get rather deep, but I have not yet encountered anything that hit a stack limit and crashed.","",""
"1365118310701600900","rtimothyedwards_19428","2026-05-21T01:11:15.2250000+00:00","Note that pretty much all of these routines were written in the 1980s.  The ""wisdom"" involved is usually about deciding whether to spend the time to analyze the method and come up with a better one, or to work on something higher up on the priority list instead.","",""
"1365118310701600900","rtimothyedwards_19428","2026-05-21T01:14:19.0570000+00:00","Right now, the next chokepoint I'm seeking is the loop at `resis/ResMakeRes.c` line 395.","",""
"262706220073222144","namibj","2026-05-21T01:21:33.0780000+00:00","Oh yeah wasn't suggesting it's necessarily a problem; but yeah. Didn't know how aware you were as it seemed to not be that much of the time actually spent in the severe recursion cases; it just became visible to me because I did so much sampling; it reports on the order of 1.4e9 cycles to have been spent in that highlighted deep region; I think it was a bit more timeline-restricted than quite fair, so probably maybe 5~10 seconds of CPU time spent in such deep recursion that it blew through the unwinding's depth limit.","",""
"262706220073222144","namibj","2026-05-21T04:12:34.8180000+00:00","<https://github.com/RTimothyEdwards/magic/blob/29447a35cdb5907f29888d7e9df35f6f41f99b9c/resis/ResMakeRes.c#L395-L400>
That linked list chase has shown to take non-insiginificant time froma  brief profile capture.
Notably, most time is supposedly spent in the pointer fetch of the if's `cmp` assembly instruction.","",""
"262706220073222144","namibj","2026-05-21T04:16:39.4420000+00:00","I'm assuming most of that linked list choice exists for mostly historical reasons due to being fairly old and the cost of these cache misses not being nearly as severe (relatively speaking) back then.
Same btw. for EastWest.","",""
"262706220073222144","namibj","2026-05-21T05:17:23.5480000+00:00","I'll have a good hour or two of profiling right in the middle of vss net resistance extraction (and probably going on to vdd or whatever nets it chooses next) for the last of the 4 GND bond pads to look at after a brief nap, though not for too long sadly, before I have to go to the office and do $dayjob things.
At this pace I do have hope that the extraction will finish within the next 24 hours and I can then get the files dragged together for you to enjoy the profiling recording of the entire run on the `0.5x0.5 TinyQV flattened` gds. I think there was some tool to bundle all the files needed to make unwinding work for you, but I'm sure I'll find a decent way to make it viewable in KDAB's hotspot for you (including decompilation view!) until then.
I'll plan to send you a .tar.zst and necessary instructions for how to feed the data to hotspot via wormhole as discord DM; let me know if that's a problem.","",""
"262706220073222144","namibj","2026-05-21T07:49:09.5070000+00:00","Also I don't know if you've heard of it before, but as far as attaining a _quantified_ and attributed understanding of `malloc`-spam goes, [KDE's heaptrack](https://invent.kde.org/sdk/heaptrack/) (from the same author as [KDAB's hotspot](https://www.kdab.com/software-technologies/developer-tools/hotspot/)) has done wonders for me when I used it on some photogrammetry/structure-from-motion toolchain [TU Darmstadt's MVE](<https://github.com/simonfuhrmann/mve>).

Small commits like <https://github.com/namibj/mapmap_cpu/commit/54076e35bc99ae882672e91b28b8308d681898e7> (heaptrack), <https://github.com/namibj/mve/commit/09c252dea56d2e4d78993ee6e0fc5663821d8509> (hotspot), or <https://github.com/namibj/mapmap_cpu/commit/fc6ea70ddccfc08f0768cf6f530fe13d179f88ad> (iirc this one was highlighted by heaptrack for suspicious allocation intensity, then hotspot was used to get a quantified understanding of how bad ||it seemed to be to try and estimate how much whole-program speedup could be reasonably expected to be attained, before I looked for a suitable (smol, easy, compatible licence) concurrent union-find library to ""easily"" vendor into the project and swap out the BFS implementation of the connected-components task for a union-find one. See below for excerpt of the changed file that should make obvious how this kind of problem could be surfaced by heaptrack.||), are representative of the impact I managed with those 7 years ago. 

```cpp
/**
 * A complet contains a partial component: a list of node, its temporary
 * component ID and the ID of seen other complets
 */
using complet = std::tuple<std::vector<luint_t>, luint_t, std::set<luint_t>>;
```
```cpp
tbb::concurrent_vector<complet> accrued_complets;
```","",""
"262706220073222144","namibj","2026-05-21T09:14:58.1030000+00:00","","2026-05_media/flamegraph_4-E4F8D.txt,2026-05_media/flamegraph_4-98EF8.svg,2026-05_media/flamegraph_4-9EBA7.png",""
"262706220073222144","namibj","2026-05-21T09:16:42.4180000+00:00","This is from two big nets (must be one or two vss and one or zero vdd); I filtered carefully but limited by pixel-perfection to the time range of these two among the over 4 hour long `perf record`'s recording.
It's CPU cycles spent while executing the process in user mode.","",""
"262706220073222144","namibj","2026-05-21T09:17:05.7070000+00:00","the txt is what it calls ""stack collapsed"" export.","",""
"262706220073222144","namibj","2026-05-21T09:17:30.1140000+00:00","The 3 files are otherwise all from the very same filtered view.","",""
"262706220073222144","namibj","2026-05-21T09:19:58.2950000+00:00","also, just fyi","2026-05_media/log_so_far_2026-05-21T09_19_0300_00-F029B.txt",""
"262706220073222144","namibj","2026-05-21T09:20:23.7780000+00:00","that's after 9h35 min of CPU time on the process.","",""
"262706220073222144","namibj","2026-05-21T09:20:50.8550000+00:00","(I just re-used the local PDK copy from the other (the large) chip.)","",""
"262706220073222144","namibj","2026-05-21T15:56:15.5840000+00:00","bad news: it crashed at the end.
good news: it appears to have finished at least almost all steps.","2026-05_media/log_so_far_2026-05-21T15_53_4600_00-091BE.txt",""
"262706220073222144","namibj","2026-05-21T16:03:17.2980000+00:00","","2026-05_media/image-CF218.png",""
"262706220073222144","namibj","2026-05-21T16:03:31.2520000+00:00","","2026-05_media/image-7017C.png",""
"262706220073222144","namibj","2026-05-21T16:03:46.4860000+00:00","","2026-05_media/image-3422C.png",""
"262706220073222144","namibj","2026-05-21T16:04:04.3870000+00:00","","2026-05_media/image-CABA7.png",""
"262706220073222144","namibj","2026-05-21T16:07:30.4370000+00:00","That _looks_ like it may be the `Bad Device Location at 210074,478892`; it lines up nicely with what seems like it could be a device's bottom left corner, and has that 5/1 scaling applied that magic spoke up at the beginning of the log.","",""
"262706220073222144","namibj","2026-05-21T16:17:53.6060000+00:00","`hotspot 1.6.0`; the `.perfparser` pre-digested recording comes soon. It's processing.","",""
"262706220073222144","namibj","2026-05-21T16:20:30.5610000+00:00","(It looks to be taking about 20 minutes to process through `/usr/libexec/hotspot-perfparser`)","",""
"1365118310701600900","rtimothyedwards_19428","2026-05-21T21:32:40.4350000+00:00","Meanwhile I worked around the issue at ResMakeRes.c:397 with a hash table so that it can convert nodes on the main pass through the linked list instead of running a second loop through the rest of the list to search for nodes that need converting.  This time I will run on your quarter-size chip so that I can see results by the end of the day, maybe, and also take a look at that crash condition.","",""
"1365118310701600900","rtimothyedwards_19428","2026-05-21T21:42:34.1840000+00:00","Sorry for talking past you somewhat here. . . It's just that there are obvious chokepoints that need to be fixed, and I don't really need a flame graph to figure out what they are and what to do about them.  I think I'm quickly getting to a point where the resistance extraction is decently efficient, at least for now.","",""
"1365118310701600900","rtimothyedwards_19428","2026-05-21T22:24:44.1690000+00:00","Also it looks like the next performance bottleneck is the use of DBPaint() and DBErase() in ResDissolveContacts().  It should not be using such high-level paint routines;  it should be pretty easy to cut a large amount of time off of those calls.","",""
"262706220073222144","namibj","2026-05-21T22:35:04.9630000+00:00","Oh sorry yeah I mostly collected it as I tried to get output from it (on the quarter slot) at the same time; it failed extracting a device as noted which seemed.... strange.

But hotspot allows masking out parts both in timeline view and in flamegraph view (arbitrary combinations) via ""filter out symbol"" to jump to the point where these smaller improvements are already presumed-done (at least the fundamental one like the hash table), so one doesn't need to wait for a run to complete just to get an understanding of what's the next most relevant part.","",""
"262706220073222144","namibj","2026-05-21T22:37:10.3280000+00:00","You might want to attempt to understant what's going on with the device extraction failure if you want to see performance of the SPICE generation at the end.
I just put all 3 versions of the quarter slot gds I have here in case I missed any.","https://media.githubusercontent.com/media/wafer-space/discord.wafer.space/master/large_media/wafer-space/Information/questions/is-magic-pex-extraction-expected-broken-for-gf180mcufdscmcu7t5v0fillcap64/2026-05/2026-05_media/tinyqv_quarter_label_flattened_01.gds-E9F16.zst,2026-05_media/tinyqv_quarter_label_edited_01.gds-93BC4.zst,2026-05_media/tinyqv_quarter.gds-37FE9.gz",""
"1365118310701600900","rtimothyedwards_19428","2026-05-21T23:17:12.1220000+00:00","Nothing like a full chip design to exercise all the corner cases. . .","",""
"1365118310701600900","rtimothyedwards_19428","2026-05-21T23:46:03.9230000+00:00","@namibj :  The full R-C extraction of `tinyqv_quarter_label_edited_01` completed on my desktop in just under two hours.  I did not get a crash condition.  I did, however, encounter two instances of `Missing rptr at (...)`, indicating an attempt to access a resistor structure that had been previously freed, and a bunch of `Missing substrate conection of device at (...)` which remains to be debugged.  I did not get any `Bad Device Location` errors.","",""
"1365118310701600900","rtimothyedwards_19428","2026-05-21T23:47:00.8890000+00:00","The final netlist is just under 2GB.","",""
"262706220073222144","namibj","2026-05-21T23:47:52.4580000+00:00","`PDK_ROOT=`realpath gf180mcu_pdk` PDK=gf180mcuD scripts/extract_spice.py /home/namibj/Downloads/tinyqv_quarter_label_flattened_01.gds --cthresh 0 --subcircuit-top --hierarchy-off`","2026-05_media/extract_spice-C9D1F.py",""
"262706220073222144","namibj","2026-05-21T23:48:36.5320000+00:00","something Xyce or ngspice would digest?","",""
"1365118310701600900","rtimothyedwards_19428","2026-05-21T23:50:48.6090000+00:00","BTW, `Missing substrate connection` means that magic could not determine what subnet a device's substrate (or bulk terminal) connects to, so while it does not exactly invalidate the netlist, it means that some devices will have a substrate connection to the default, which would be the label at the pad for one of the VDD or VSS pins, and not somewhere deep inside the substrate's resistor network where it should be.  The final output SPICE _might_ be digestible by Xyce.  Not sure how ngspice will handle a 2GB netlist.","",""
"262706220073222144","namibj","2026-05-21T23:50:55.6580000+00:00","if there's anything convenient in particular I should add to get step progress information in the future I'd be happy to add that","",""
"262706220073222144","namibj","2026-05-21T23:51:49.4680000+00:00","ngspice was more of a ""in theory it meets the spec"" part; I'm squarely looking at Xyce for this type of job.","",""
"1365118310701600900","rtimothyedwards_19428","2026-05-21T23:53:05.1600000+00:00","This is the shell script I'm using to do the extraction.  It is hard-coded to my PDK location and the GDS file and top cell name.","2026-05_media/run_tinyqv_rcx_extract-C26FE.sh",""
"262706220073222144","namibj","2026-05-21T23:53:49.6310000+00:00","The above linked script's output on designs like a TT submission or in this case, iirc Tholin's DAC hard macro, resulted in a valid netlist.","",""
"262706220073222144","namibj","2026-05-21T23:54:46.2120000+00:00","I'm positive the prior version which to my eye had identical tcl fed to magic aside from the obvious path/name differences produced functional ngspice and Xyce netlist.","",""
"262706220073222144","namibj","2026-05-21T23:55:36.1050000+00:00","thanks for your script","",""
"262706220073222144","namibj","2026-05-21T23:56:05.2210000+00:00","(I'm about to sleep though, so best of luck to you and big thanks already.)","",""
"262706220073222144","namibj","2026-05-21T23:57:16.9600000+00:00","As for the substrate connection, I think the sealring was isolated on all layers both to the inside and the outside of the chip.
I think some ESD diodes in IO pads may also expect implicit substrate connectivity.","",""
"1365118310701600900","rtimothyedwards_19428","2026-05-22T00:00:11.7130000+00:00","I am on travel from some time mid-day tomorrow, so I might not get back to work on it for a few days.","",""
"262706220073222144","namibj","2026-05-22T00:00:56.5020000+00:00","If it's just a 2-hour run I'd at least strongly consider throwing mozilla's rr at it, fast forward in the replay to the missing rptr notice via probably a breakpoint set to where the notice is emitted, then use reverse-continue with data watchpoints on the allocations that got freed before.
Your deep knowledge ofc may bring a more specific path of debugging that to light.","",""
"262706220073222144","namibj","2026-05-22T00:05:31.3250000+00:00","That's no problem gives me time to port my MCML VCO efforts from sky130A to gf180mcuD to see where the speeds and sizing are approximately at; such that I can get the PCell topology adjusted and at least hope to make it for the RUn2 deadline even though I failed to make it for the ttsky26a deadline (barely got two instances of a DNL-compensatable-via-digital-calibration DAC onto it, instead of the supposed DAC-tuned PLL/VCO core).","",""
"1365118310701600900","rtimothyedwards_19428","2026-05-22T16:07:10.7540000+00:00","I pushed another update in which I got rid of the calls to DBPaint() and DBErase() in favor of simpler lower-level subroutines that do the same thing more efficiently.  The total time to process the quarter chip is now down to just under an hour and a half.  The process is now spending much of the time doing connectivity searches, which is already highly optimized, so I don't think there will be too much further opportunity to cut significant percentages off of the processing time.","",""
"262706220073222144","namibj","2026-05-22T17:29:50.3080000+00:00","ok","",""
"1365118310701600900","rtimothyedwards_19428","2026-05-25T02:04:55.7330000+00:00","I found another issue in the code and knocked down the time from 1 1/2 hours to 1 hour (so I cut another 50% off of the extraction time).  (Version 8.3.649).","",""
"262706220073222144","namibj","2026-05-25T18:53:23.0140000+00:00","Yay. 

(I'm sorry the heatwave has impacted my productivity.)","",""
"1365118310701600900","rtimothyedwards_19428","2026-05-25T20:54:09.9620000+00:00","You're way overproductive and the heat wave is allowing me to catch up.  : )","",""
"169786952432746498","mithro_","2026-05-25T23:03:06.2370000+00:00","Random fact, US circuits suck, so the only place I could plug in my server that provided enough power was the power point for my AC (which was 240V). 

I either had A/C or a 2400 watt heater (IE the server), great for winter, terrible for summer 🙂

I ended up building a mini-datacenter to deal with the heat and stuff....","2026-05_media/AP1GczP81uPF2LpfXV3qBbqxBWsXeP9BRI1UAb5R-Y-DFCB9.png,2026-05_media/AP1GczMS15Yv7UuQCuK3lNgI5-bdpW7mz-TZ3W1vdv-B2B79.png,2026-05_media/AP1GczM9eOdA4ZhZYqiaXbi_1k5IVWUPxkvGlmkC5M-0BF46.png",""
"1365118310701600900","rtimothyedwards_19428","2026-05-25T23:17:03.0960000+00:00","I visited Tim in his apartment and I can attest to the fact that he was basically living in a server closet.","",""
"1365118310701600900","rtimothyedwards_19428","2026-05-25T23:20:16.0800000+00:00","I can also attest to the fact that many (most?) houses and apartments in the Bay Area are built without either insulation or air conditioning, and when it hits 38C in San Jose (which is fortunately rare, but it does happen), it is a bit like living in an oven with no door.","",""
"262706220073222144","namibj","2026-05-26T03:49:20.5600000+00:00","I'm turning my shed into my data center, though it'll be fresh air intake (filtered) with just hot/cold aisle separation.","",""
"262706220073222144","namibj","2026-05-26T03:52:22.7210000+00:00","Gotta knock out the SAS and power cable hole between the two chassis and 3d print a baffle up front to make the top one suck it's air through the hdds caged in the bottom before hitting the ssds and then the fans and then the ram/CPUs, before meeting the rest.","",""
"169786952432746498","mithro_","2026-05-26T08:53:22.2580000+00:00","My dad is helping me turn an old shed into that right now too!","2026-05_media/get_attachment_url-A151F.png","💜 (1)"
"1365118310701600900","rtimothyedwards_19428","2026-05-26T21:12:26.5050000+00:00","@namibj :  I looked into the problem with the ""missing substrate"" terminal detection, determined that it happens specifically on diodes, and specifically because diodes have 2 or 3 terminals, and there is code for ""extresist"" that still expects all devices to be 4-terminal FETs.  I previously (a long time ago) added some lines that ignore devices that have fewer than 4 terminals, as a way to avoid the problem while working on other things, but I forgot that was in there, and the handling of diodes has never been checked.  I started fixing that but am running into segfaults, and it looks like a not so easy problem to track down the places where two or three terminal devices are not being handled correctly.","",""
"262706220073222144","namibj","2026-05-26T21:22:59.3040000+00:00","oh. I'm unfortunately too busy to hunt down those memory bugs until towards end of next week, sadly.

In similar extraction spirit, do you happent o have _any_ knwoledge of 3v3 native nmos existing on this process, and if so, whether there might be something vaguely-practical to mash existing nmos_03v3 and nmos_06v0_nvt models together considering that they at least claim to be physically-based and the only physical substantial difference should be the oxide thickness that's deposited?
At least that's the only explanation I could come up with that wouldn't involve an extra physical mask to handle 3v3_nvt in addition to 6v0_nvt.","",""
