AuthorID,Author,Date,Content,Attachments,Reactions
"709384666909507634","egorxe","2025-11-30T14:54:26.2020000+00:00","@Leo Moser (mole99) Will it be possible to wave some Magic DRC errors in precheck as long as all KLayout checks are fine? The problem is I'm inconsistently getting Magic DRC errors in factory provided SRAMs. There are several SRAM macros in [our testchip design](https://github.com/ZeduloTech/gf180mcu-testchip2025/blob/e57c1a503bc76d012670eb28d11fc9468af8396c/final/gds/chip_top.gds.gz) and sometimes weird ""Can't overlap those layers"" DRC errors are reported inside one or two SRAMs, while others are fine. There is nothing else besides the SRAM internals and dummy fill metals in the DRC area, so it looks like a Magic DRC issue. I'll report the issue itself later, for now I just would like to know if it'll be possible to wave some errors while uploading final GDS to the platform, as I doubt that it'll be possible to debug and fix the issue prior to deadline.","",""
"323371864074485771","mole99","2025-11-30T16:07:47.8560000+00:00","Hi Egor, how did you run DRC? Did you use the Nix shell in the template or did you use custom versions of the tools and the PDK?
For the final check you should use https://github.com/wafer-space/gf180mcu-precheck, since it will run in the online precheck.
Other designs haven't had issues with the SRAMs so far, but you need to flatten a number of cells in magic.

Normally, you need to pass both the magic and KLayout DRC deck. Neither DRC deck is a complete implementation and therefore we run both for better coverage.

We will likely waive some magic DRC checks (e.g. CO.3 and CO.4) since they were verified to be slightly inaccurate implementations.","",""
"709384666909507634","egorxe","2025-11-30T16:11:16.1720000+00:00","I'm running inside the nix environment from the precheck, nothing custom. You could check it yourself with the GDS from the link if you have time, but you have to skip zero polygon check as it will fail on this GDS revision :).","",""
"323371864074485771","mole99","2025-11-30T18:14:03.6880000+00:00","I'll check it tomorrow, no worries about the zero area polygons for now :)","",""
"709384666909507634","egorxe","2025-11-30T18:57:22.6710000+00:00","Thanks, Leo! I've fixed zero area polygons [in the next revision](https://github.com/ZeduloTech/gf180mcu-testchip2025/blob/3f49a9b414d45c7de78c40d2b5e2279501ac4e35/final/gds/chip_top.gds.gz) anyway. Also I saw your review request for the python DRC script, but all my free time is going towards finishing GDS for the tapeout :). I'll try to review the script thoughtfully tomorrow, sorry for the delay.","",""
