AuthorID,Author,Date,Content,Attachments,Reactions
"169786952432746498","mithro_","2025-08-21T17:05:34.4880000+00:00","","","👍 (2),❤️ (1)"
"220639106915368960","tholin","2025-08-21T19:06:47.5380000+00:00","Essentially, my goal for my next gf180 tapeout is it to ditch caravel and build a headless setup for my multi-project dies while also providing at least one analog output pin. In other words, I need a custom padring. And I heard there are people here already making progress towards such a thing.","",""
"323371864074485771","mole99","2025-08-22T06:28:52.4910000+00:00","You can create a custom padring using the [leo/padring](https://github.com/librelane/librelane/tree/leo/padring) (experimental) branch in LibreLane. I had a setup for gf180mcu lying around somewhere, will have to see if I can find it again.","",""
"756011607603019777","anfroholic","2025-08-23T18:10:38.2680000+00:00","Is the padring you're referring to for wirebonding, or a wscp layout?","",""
"323371864074485771","mole99","2025-08-23T18:54:39.1500000+00:00","We focus on wire bonding. GF180MCU would also support solder bumps, but for that you need the MetalTop option afaik.","","👍 (1)"
